SET session_replication_role = replica;

--
-- PostgreSQL database dump
--

-- \restrict F3d29VlbSWtDDYECZ9CzBEE8Rufz9U8HBm9NX91tyZlleQ6NDvwVF4LaF17h8Kb

-- Dumped from database version 17.6
-- Dumped by pg_dump version 17.6

SET statement_timeout = 0;
SET lock_timeout = 0;
SET idle_in_transaction_session_timeout = 0;
SET transaction_timeout = 0;
SET client_encoding = 'UTF8';
SET standard_conforming_strings = on;
SELECT pg_catalog.set_config('search_path', 'public, extensions', false);
SET check_function_bodies = false;
SET xmloption = content;
SET client_min_messages = warning;
SET row_security = off;

--
-- Data for Name: organizations; Type: TABLE DATA; Schema: public; Owner: postgres
--

INSERT INTO organizations (id, name, type, url, phone_number, address_line1, address_line2, city, state, postal_code, country, description, allowed_domains, created_at, updated_at) VALUES ('3f029deb-55fe-4956-b41e-a44cfda7cd99', 'Smith Productions', 'Production', NULL, NULL, NULL, NULL, NULL, NULL, NULL, NULL, NULL, NULL, '2025-11-05 21:36:21.25698+00', '2025-11-05 21:36:21.25698+00');
INSERT INTO organizations (id, name, type, url, phone_number, address_line1, address_line2, city, state, postal_code, country, description, allowed_domains, created_at, updated_at) VALUES ('d82d53cf-4682-4778-a2af-06ae74769fe4', 'Central Park Amphitheater', 'Venue', NULL, NULL, NULL, NULL, 'Los Angeles', 'CA', NULL, 'USA', NULL, NULL, '2025-11-11 05:49:03.436147+00', '2025-11-11 05:49:03.436147+00');
INSERT INTO organizations (id, name, type, url, phone_number, address_line1, address_line2, city, state, postal_code, country, description, allowed_domains, created_at, updated_at) VALUES ('155ee642-6640-445e-bfae-b88f65a43c9c', 'Grand Ballroom Hotel', 'Venue', NULL, NULL, NULL, NULL, 'New York', 'NY', NULL, 'USA', NULL, NULL, '2025-11-11 05:49:03.436147+00', '2025-11-11 05:49:03.436147+00');
INSERT INTO organizations (id, name, type, url, phone_number, address_line1, address_line2, city, state, postal_code, country, description, allowed_domains, created_at, updated_at) VALUES ('5c215d0b-44d9-4e4b-9b5d-d906aece60b6', 'Lakeside Garden Venue', 'Venue', NULL, NULL, NULL, NULL, 'Chicago', 'IL', NULL, 'USA', NULL, NULL, '2025-11-11 05:49:03.436147+00', '2025-11-11 05:49:03.436147+00');
INSERT INTO organizations (id, name, type, url, phone_number, address_line1, address_line2, city, state, postal_code, country, description, allowed_domains, created_at, updated_at) VALUES ('b26965c5-86a9-433b-af66-fe762f9c3290', 'The Blue Note Jazz Club', 'Venue', NULL, NULL, NULL, NULL, 'New York', 'NY', NULL, 'USA', NULL, NULL, '2025-11-11 05:49:03.436147+00', '2025-11-11 05:49:03.436147+00');
INSERT INTO organizations (id, name, type, url, phone_number, address_line1, address_line2, city, state, postal_code, country, description, allowed_domains, created_at, updated_at) VALUES ('aea5fe93-9934-4146-bdb7-59539ec18427', 'Metropolitan Center', 'Venue', NULL, NULL, NULL, NULL, 'Chicago', 'IL', NULL, 'USA', NULL, NULL, '2025-11-11 05:49:03.436147+00', '2025-11-11 05:49:03.436147+00');
INSERT INTO organizations (id, name, type, url, phone_number, address_line1, address_line2, city, state, postal_code, country, description, allowed_domains, created_at, updated_at) VALUES ('d15db3e1-d8be-466f-90ac-c7e4a86b0a09', 'Red Rocks Amphitheatre', 'Venue', NULL, NULL, NULL, NULL, 'Morrison', 'CO', NULL, 'USA', NULL, NULL, '2025-11-11 05:49:03.436147+00', '2025-11-11 05:49:03.436147+00');
INSERT INTO organizations (id, name, type, url, phone_number, address_line1, address_line2, city, state, postal_code, country, description, allowed_domains, created_at, updated_at) VALUES ('ac5f45a4-fa86-45e6-9661-e85493417f99', 'Radio City Music Hall', 'Venue', NULL, NULL, NULL, NULL, 'New York', 'NY', NULL, 'USA', NULL, NULL, '2025-11-11 05:49:03.436147+00', '2025-11-11 05:49:03.436147+00');
INSERT INTO organizations (id, name, type, url, phone_number, address_line1, address_line2, city, state, postal_code, country, description, allowed_domains, created_at, updated_at) VALUES ('b02bb530-77d1-4f29-8b32-dc7a69f1e3ef', 'The Greek Theatre', 'Venue', NULL, NULL, NULL, NULL, 'Los Angeles', 'CA', NULL, 'USA', NULL, NULL, '2025-11-11 05:49:03.436147+00', '2025-11-11 05:49:03.436147+00');
INSERT INTO organizations (id, name, type, url, phone_number, address_line1, address_line2, city, state, postal_code, country, description, allowed_domains, created_at, updated_at) VALUES ('0273bdfa-6090-4acd-ba8b-6a790cc5fcf7', 'The Fillmore', 'Venue', NULL, NULL, NULL, NULL, 'San Francisco', 'CA', NULL, 'USA', NULL, NULL, '2025-11-11 05:49:03.436147+00', '2025-11-11 05:49:03.436147+00');
INSERT INTO organizations (id, name, type, url, phone_number, address_line1, address_line2, city, state, postal_code, country, description, allowed_domains, created_at, updated_at) VALUES ('9e253369-26be-4889-bc31-2b4f7b3df404', 'House of Blues', 'Venue', NULL, NULL, NULL, NULL, 'Boston', 'MA', NULL, 'USA', NULL, NULL, '2025-11-11 05:49:03.436147+00', '2025-11-11 05:49:03.436147+00');
INSERT INTO organizations (id, name, type, url, phone_number, address_line1, address_line2, city, state, postal_code, country, description, allowed_domains, created_at, updated_at) VALUES ('789248bc-07be-41d1-9d93-3bde0905c452', 'Sarah Johnson Quartet', 'Act', NULL, NULL, NULL, NULL, 'New York', 'NY', NULL, 'USA', NULL, NULL, '2025-11-11 05:49:55.425261+00', '2025-11-11 05:49:55.425261+00');
INSERT INTO organizations (id, name, type, url, phone_number, address_line1, address_line2, city, state, postal_code, country, description, allowed_domains, created_at, updated_at) VALUES ('03f9b748-a78b-4f27-9efc-1c31fdbde8c6', 'Electric Dreams Band', 'Act', NULL, NULL, NULL, NULL, 'Los Angeles', 'CA', NULL, 'USA', NULL, NULL, '2025-11-11 05:49:55.425261+00', '2025-11-11 05:49:55.425261+00');
INSERT INTO organizations (id, name, type, url, phone_number, address_line1, address_line2, city, state, postal_code, country, description, allowed_domains, created_at, updated_at) VALUES ('aab639ff-92fa-4ac0-a9b5-cb74146f27ac', 'Jazz Collective', 'Act', NULL, NULL, NULL, NULL, 'Chicago', 'IL', NULL, 'USA', NULL, NULL, '2025-11-11 05:49:55.425261+00', '2025-11-11 05:49:55.425261+00');
INSERT INTO organizations (id, name, type, url, phone_number, address_line1, address_line2, city, state, postal_code, country, description, allowed_domains, created_at, updated_at) VALUES ('a7b133e1-a8ab-45c5-b6b0-50438e6f5df4', 'The Acoustic Sessions', 'Act', NULL, NULL, NULL, NULL, 'Austin', 'TX', NULL, 'USA', NULL, NULL, '2025-11-11 05:49:55.425261+00', '2025-11-11 05:49:55.425261+00');
INSERT INTO organizations (id, name, type, url, phone_number, address_line1, address_line2, city, state, postal_code, country, description, allowed_domains, created_at, updated_at) VALUES ('f74cf4ff-8125-4f22-954c-dbff03bfd494', 'Symphony Orchestra', 'Act', NULL, NULL, NULL, NULL, 'Boston', 'MA', NULL, 'USA', NULL, NULL, '2025-11-11 05:49:55.425261+00', '2025-11-11 05:49:55.425261+00');
INSERT INTO organizations (id, name, type, url, phone_number, address_line1, address_line2, city, state, postal_code, country, description, allowed_domains, created_at, updated_at) VALUES ('1be9bec6-d721-4d56-a847-c9e4153adfed', 'Rock Revolution', 'Act', NULL, NULL, NULL, NULL, 'Seattle', 'WA', NULL, 'USA', NULL, NULL, '2025-11-11 05:49:55.425261+00', '2025-11-11 05:49:55.425261+00');
INSERT INTO organizations (id, name, type, url, phone_number, address_line1, address_line2, city, state, postal_code, country, description, allowed_domains, created_at, updated_at) VALUES ('553f5e86-78d1-4bfe-9ca6-b6890637e257', 'Country Roads Trio', 'Act', NULL, NULL, NULL, NULL, 'Nashville', 'TN', NULL, 'USA', NULL, NULL, '2025-11-11 05:49:55.425261+00', '2025-11-11 05:49:55.425261+00');
INSERT INTO organizations (id, name, type, url, phone_number, address_line1, address_line2, city, state, postal_code, country, description, allowed_domains, created_at, updated_at) VALUES ('ddd4dc3c-ce64-48fc-a9c6-0bcbfe61f68c', 'The Blues Brothers Tribute', 'Act', NULL, NULL, NULL, NULL, 'Chicago', 'IL', NULL, 'USA', NULL, NULL, '2025-11-11 05:49:55.425261+00', '2025-11-11 05:49:55.425261+00');
INSERT INTO organizations (id, name, type, url, phone_number, address_line1, address_line2, city, state, postal_code, country, description, allowed_domains, created_at, updated_at) VALUES ('017dae2c-6db3-447a-bbd3-be2ec14c3eff', 'Soundwave Productions', 'Production', 'https://soundwaveprod.com', NULL, NULL, NULL, 'Los Angeles', 'CA', NULL, 'USA', NULL, NULL, '2025-11-11 05:49:55.425261+00', '2025-11-11 05:49:55.425261+00');
INSERT INTO organizations (id, name, type, url, phone_number, address_line1, address_line2, city, state, postal_code, country, description, allowed_domains, created_at, updated_at) VALUES ('7d823aa7-55e1-4e18-9b86-0405043732c4', 'Lumina Lighting Co.', 'Lighting', 'https://luminalighting.com', NULL, NULL, NULL, 'Nashville', 'TN', NULL, 'USA', NULL, NULL, '2025-11-11 05:49:55.425261+00', '2025-11-11 05:49:55.425261+00');
INSERT INTO organizations (id, name, type, url, phone_number, address_line1, address_line2, city, state, postal_code, country, description, allowed_domains, created_at, updated_at) VALUES ('ac3e1208-6a6e-4814-a244-17e92c584b0b', 'ProStage Rentals', 'Staging', NULL, NULL, NULL, NULL, 'Chicago', 'IL', NULL, 'USA', NULL, NULL, '2025-11-11 05:49:55.425261+00', '2025-11-11 05:49:55.425261+00');
INSERT INTO organizations (id, name, type, url, phone_number, address_line1, address_line2, city, state, postal_code, country, description, allowed_domains, created_at, updated_at) VALUES ('9f60c1f7-a4b2-499b-802c-46ef4ba552f5', 'Elite Sound Systems', 'Sound', NULL, NULL, NULL, NULL, 'New York', 'NY', NULL, 'USA', NULL, NULL, '2025-11-11 05:49:55.425261+00', '2025-11-11 05:49:55.425261+00');
INSERT INTO organizations (id, name, type, url, phone_number, address_line1, address_line2, city, state, postal_code, country, description, allowed_domains, created_at, updated_at) VALUES ('07b92342-c677-4d7a-8988-b8ae49f7aaef', 'Brilliance Lighting', 'Lighting', NULL, NULL, NULL, NULL, 'Los Angeles', 'CA', NULL, 'USA', NULL, NULL, '2025-11-11 05:49:55.425261+00', '2025-11-11 05:49:55.425261+00');
INSERT INTO organizations (id, name, type, url, phone_number, address_line1, address_line2, city, state, postal_code, country, description, allowed_domains, created_at, updated_at) VALUES ('6e94b1e8-503a-4638-9f5e-deed9dbcee72', 'Milbourne Sound', 'Sound', 'https://www.milbourne.com/', '925 555-5555', '3225 Sun Valley Avenue', NULL, 'Walnut Creek', 'CA', '94597', 'United States', NULL, 'milbourne.com', '2025-11-06 04:51:38.617986+00', '2025-11-15 04:29:57.907366+00');
INSERT INTO organizations (id, name, type, url, phone_number, address_line1, address_line2, city, state, postal_code, country, description, allowed_domains, created_at, updated_at) VALUES ('9130b451-1474-4dda-8549-39713313a3b3', 'Classical Ensemble', 'Act', NULL, NULL, '1234 Main', NULL, 'Philadelphia', 'PA', NULL, 'USA', NULL, NULL, '2025-11-11 05:49:55.425261+00', '2025-11-16 06:35:56.624249+00');
INSERT INTO organizations (id, name, type, url, phone_number, address_line1, address_line2, city, state, postal_code, country, description, allowed_domains, created_at, updated_at) VALUES ('09fca024-b5c1-4f81-a71b-a68361548948', 'Act4Audio', 'Sound', 'https://act4audio.com', NULL, NULL, NULL, NULL, NULL, NULL, NULL, NULL, 'act4audio.com', '2025-11-16 06:36:49.616038+00', '2025-11-16 06:36:49.616038+00');
INSERT INTO organizations (id, name, type, url, phone_number, address_line1, address_line2, city, state, postal_code, country, description, allowed_domains, created_at, updated_at) VALUES ('89b01570-f201-4939-abc0-bae126d12577', 'The Band', 'Act', NULL, NULL, NULL, NULL, NULL, NULL, NULL, NULL, NULL, NULL, '2026-02-04 20:00:59.115967+00', '2026-02-04 20:00:59.115967+00');
INSERT INTO organizations (id, name, type, url, phone_number, address_line1, address_line2, city, state, postal_code, country, description, allowed_domains, created_at, updated_at) VALUES ('6bc48db4-2a7f-4cd3-9407-f40b8e4985fb', 'Venue Name', 'Venue', NULL, NULL, NULL, NULL, NULL, NULL, NULL, NULL, NULL, NULL, '2026-02-04 20:00:59.545456+00', '2026-02-04 20:00:59.545456+00');
INSERT INTO organizations (id, name, type, url, phone_number, address_line1, address_line2, city, state, postal_code, country, description, allowed_domains, created_at, updated_at) VALUES ('632d52f1-1aac-4810-ae76-35ccee4e3866', 'Spazmatics', 'Act', NULL, NULL, NULL, NULL, NULL, NULL, NULL, NULL, NULL, NULL, '2026-02-07 07:54:17.491531+00', '2026-02-07 07:54:17.491531+00');
INSERT INTO organizations (id, name, type, url, phone_number, address_line1, address_line2, city, state, postal_code, country, description, allowed_domains, created_at, updated_at) VALUES ('63fd3d39-d132-425f-88c6-e7c4c77deef7', 'Dan''s Irish Pub', 'Venue', NULL, NULL, NULL, NULL, NULL, NULL, NULL, NULL, NULL, NULL, '2026-02-07 07:54:18.068132+00', '2026-02-07 07:54:18.068132+00');
INSERT INTO organizations (id, name, type, url, phone_number, address_line1, address_line2, city, state, postal_code, country, description, allowed_domains, created_at, updated_at) VALUES ('c331394f-73f9-4ec2-938a-282da1378f9a', 'New Band', 'Act', NULL, NULL, NULL, NULL, NULL, NULL, NULL, NULL, NULL, NULL, '2026-02-07 10:02:42.914721+00', '2026-02-07 10:02:42.914721+00');
INSERT INTO organizations (id, name, type, url, phone_number, address_line1, address_line2, city, state, postal_code, country, description, allowed_domains, created_at, updated_at) VALUES ('c0fcc02c-c3d2-46ad-87d3-b12bf3af0f90', 'New Venue', 'Venue', NULL, NULL, NULL, NULL, NULL, NULL, NULL, NULL, NULL, NULL, '2026-02-07 10:02:43.292784+00', '2026-02-07 10:02:43.292784+00');
INSERT INTO organizations (id, name, type, url, phone_number, address_line1, address_line2, city, state, postal_code, country, description, allowed_domains, created_at, updated_at) VALUES ('ba9ff468-e4b8-4f62-953e-040bc0ec416d', 'Midnight Reruns', 'Act', NULL, NULL, NULL, NULL, NULL, NULL, NULL, NULL, NULL, NULL, '2026-02-09 05:18:57.223714+00', '2026-02-09 05:18:57.223714+00');
INSERT INTO organizations (id, name, type, url, phone_number, address_line1, address_line2, city, state, postal_code, country, description, allowed_domains, created_at, updated_at) VALUES ('0e39fd33-f09e-4f3e-b225-a7f71192c10f', 'Meenar''s Music Club', 'Venue', NULL, NULL, NULL, NULL, NULL, NULL, NULL, NULL, NULL, NULL, '2026-02-09 05:18:57.664447+00', '2026-02-09 05:18:57.664447+00');
INSERT INTO organizations (id, name, type, url, phone_number, address_line1, address_line2, city, state, postal_code, country, description, allowed_domains, created_at, updated_at) VALUES ('828d89b5-34c4-4375-9cc5-0e8578189df2', 'Private', 'Venue', NULL, NULL, NULL, NULL, NULL, NULL, NULL, NULL, NULL, NULL, '2026-02-09 05:18:58.599243+00', '2026-02-09 05:18:58.599243+00');
INSERT INTO organizations (id, name, type, url, phone_number, address_line1, address_line2, city, state, postal_code, country, description, allowed_domains, created_at, updated_at) VALUES ('1a819eac-9538-4464-956e-1d4bca313e4e', 'Blue Valley', 'Act', NULL, NULL, NULL, NULL, NULL, NULL, NULL, NULL, NULL, NULL, '2026-02-09 05:18:59.182013+00', '2026-02-09 05:18:59.182013+00');
INSERT INTO organizations (id, name, type, url, phone_number, address_line1, address_line2, city, state, postal_code, country, description, allowed_domains, created_at, updated_at) VALUES ('ddd467b5-cd8a-4bb4-99a9-556dace68065', 'Las Positas Winery', 'Venue', NULL, NULL, NULL, NULL, NULL, NULL, NULL, NULL, NULL, NULL, '2026-02-09 05:18:59.570165+00', '2026-02-09 05:18:59.570165+00');
INSERT INTO organizations (id, name, type, url, phone_number, address_line1, address_line2, city, state, postal_code, country, description, allowed_domains, created_at, updated_at) VALUES ('cd8a7ac1-70b0-45dc-bbeb-cfae46536d29', 'Mixed Nuts', 'Act', NULL, NULL, NULL, NULL, NULL, NULL, NULL, NULL, NULL, NULL, '2026-02-09 05:19:00.594977+00', '2026-02-09 05:19:00.594977+00');
INSERT INTO organizations (id, name, type, url, phone_number, address_line1, address_line2, city, state, postal_code, country, description, allowed_domains, created_at, updated_at) VALUES ('825a133a-fef7-4bf8-974c-f429845269ce', 'Pleasant Hill Community Center', 'Venue', NULL, NULL, NULL, NULL, NULL, NULL, NULL, NULL, NULL, NULL, '2026-02-09 05:19:00.951794+00', '2026-02-09 05:19:00.951794+00');
INSERT INTO organizations (id, name, type, url, phone_number, address_line1, address_line2, city, state, postal_code, country, description, allowed_domains, created_at, updated_at) VALUES ('99693fdc-ecd5-49b7-aa95-9caa7e0431a0', 'Revive', 'Act', NULL, NULL, NULL, NULL, NULL, NULL, NULL, NULL, NULL, NULL, '2026-02-09 05:19:01.729263+00', '2026-02-09 05:19:01.729263+00');
INSERT INTO organizations (id, name, type, url, phone_number, address_line1, address_line2, city, state, postal_code, country, description, allowed_domains, created_at, updated_at) VALUES ('cb833228-88c7-4245-a184-d365e4fdb40d', 'Creekside Community Church', 'Venue', NULL, NULL, NULL, NULL, NULL, NULL, NULL, NULL, NULL, NULL, '2026-02-09 05:19:02.092592+00', '2026-02-09 05:19:02.092592+00');
INSERT INTO organizations (id, name, type, url, phone_number, address_line1, address_line2, city, state, postal_code, country, description, allowed_domains, created_at, updated_at) VALUES ('c8bd84bd-64a1-4866-89dd-c32473bfde5c', 'Robert, Music', 'Act', NULL, NULL, NULL, NULL, NULL, NULL, NULL, NULL, NULL, NULL, '2026-02-09 05:19:02.863302+00', '2026-02-09 05:19:02.863302+00');
INSERT INTO organizations (id, name, type, url, phone_number, address_line1, address_line2, city, state, postal_code, country, description, allowed_domains, created_at, updated_at) VALUES ('6bac75a5-acde-445c-9bab-b7bb049952e2', 'Pioneer Saloon', 'Venue', NULL, NULL, NULL, NULL, NULL, NULL, NULL, NULL, NULL, NULL, '2026-02-09 05:19:03.187722+00', '2026-02-09 05:19:03.187722+00');
INSERT INTO organizations (id, name, type, url, phone_number, address_line1, address_line2, city, state, postal_code, country, description, allowed_domains, created_at, updated_at) VALUES ('9ced396d-5cb2-4835-9f1e-66ba3f741406', 'Norm''s Place', 'Venue', NULL, NULL, NULL, NULL, NULL, NULL, NULL, NULL, NULL, NULL, '2026-02-09 05:19:03.75083+00', '2026-02-09 05:19:03.75083+00');
INSERT INTO organizations (id, name, type, url, phone_number, address_line1, address_line2, city, state, postal_code, country, description, allowed_domains, created_at, updated_at) VALUES ('21ca7612-aab0-4c00-be33-aaeab172a906', 'Lafayette Theatre', 'Venue', NULL, NULL, NULL, NULL, NULL, NULL, NULL, NULL, NULL, NULL, '2026-02-09 05:19:04.313469+00', '2026-02-09 05:19:04.313469+00');
INSERT INTO organizations (id, name, type, url, phone_number, address_line1, address_line2, city, state, postal_code, country, description, allowed_domains, created_at, updated_at) VALUES ('b921586b-68a2-4373-8b7c-eeb4d2ef0b8c', 'Fleetwood Macrame', 'Act', NULL, NULL, NULL, NULL, NULL, NULL, NULL, NULL, NULL, NULL, '2026-02-09 05:19:05.04434+00', '2026-02-09 05:19:05.04434+00');
INSERT INTO organizations (id, name, type, url, phone_number, address_line1, address_line2, city, state, postal_code, country, description, allowed_domains, created_at, updated_at) VALUES ('6c03ce1a-e6e9-4c08-a42e-f225b7f708ff', 'Neon Velvet', 'Act', NULL, NULL, NULL, NULL, NULL, NULL, NULL, NULL, NULL, NULL, '2026-02-09 05:19:05.611679+00', '2026-02-09 05:19:05.611679+00');
INSERT INTO organizations (id, name, type, url, phone_number, address_line1, address_line2, city, state, postal_code, country, description, allowed_domains, created_at, updated_at) VALUES ('fbe26d6b-6835-474c-b972-b7d36fdd6114', 'Gold Bar Whiskey Distillery Tasting Room', 'Venue', NULL, NULL, NULL, NULL, NULL, NULL, NULL, NULL, NULL, NULL, '2026-02-09 05:19:06.176007+00', '2026-02-09 05:19:06.176007+00');
INSERT INTO organizations (id, name, type, url, phone_number, address_line1, address_line2, city, state, postal_code, country, description, allowed_domains, created_at, updated_at) VALUES ('62fe8870-8608-4e44-b6bf-8eef1c0cb75d', 'Hazy BBQ', 'Venue', NULL, NULL, NULL, NULL, NULL, NULL, NULL, NULL, NULL, NULL, '2026-02-09 05:19:06.724539+00', '2026-02-09 05:19:06.724539+00');
INSERT INTO organizations (id, name, type, url, phone_number, address_line1, address_line2, city, state, postal_code, country, description, allowed_domains, created_at, updated_at) VALUES ('ba1084b2-abaf-4980-87d2-23deb87985ce', 'Milbourne Sound', 'Act', NULL, NULL, NULL, NULL, NULL, NULL, NULL, NULL, NULL, NULL, '2026-02-09 05:19:07.471529+00', '2026-02-09 05:19:07.471529+00');
INSERT INTO organizations (id, name, type, url, phone_number, address_line1, address_line2, city, state, postal_code, country, description, allowed_domains, created_at, updated_at) VALUES ('b6b330b9-80c9-4352-ac2e-ed395d84c161', 'Walnut Creek Art-n-Wine', 'Venue', NULL, NULL, NULL, NULL, NULL, NULL, NULL, NULL, NULL, NULL, '2026-02-09 05:19:07.760836+00', '2026-02-09 05:19:07.760836+00');
INSERT INTO organizations (id, name, type, url, phone_number, address_line1, address_line2, city, state, postal_code, country, description, allowed_domains, created_at, updated_at) VALUES ('bf545f52-cf50-4d82-975f-855ddcb0a8ce', 'Redwood City Music', 'Venue', NULL, NULL, NULL, NULL, NULL, NULL, NULL, NULL, NULL, NULL, '2026-02-09 05:19:08.520681+00', '2026-02-09 05:19:08.520681+00');
INSERT INTO organizations (id, name, type, url, phone_number, address_line1, address_line2, city, state, postal_code, country, description, allowed_domains, created_at, updated_at) VALUES ('afebf956-8d10-4a2b-a20f-0f2ba9a44631', 'Earth, Wind & Fire', 'Act', NULL, NULL, NULL, NULL, NULL, NULL, NULL, NULL, NULL, NULL, '2026-02-09 05:19:09.16627+00', '2026-02-09 05:19:09.16627+00');
INSERT INTO organizations (id, name, type, url, phone_number, address_line1, address_line2, city, state, postal_code, country, description, allowed_domains, created_at, updated_at) VALUES ('540fa944-fce5-4b06-bbf0-5a2418382883', 'Fox Theatre', 'Venue', NULL, NULL, NULL, NULL, NULL, NULL, NULL, NULL, NULL, NULL, '2026-02-09 05:19:09.513274+00', '2026-02-09 05:19:09.513274+00');
INSERT INTO organizations (id, name, type, url, phone_number, address_line1, address_line2, city, state, postal_code, country, description, allowed_domains, created_at, updated_at) VALUES ('2a045a3f-81df-44a4-8b94-76839c2fa32c', 'Cheeseballs', 'Act', NULL, NULL, NULL, NULL, NULL, NULL, NULL, NULL, NULL, NULL, '2026-02-09 05:19:10.015454+00', '2026-02-09 05:19:10.015454+00');
INSERT INTO organizations (id, name, type, url, phone_number, address_line1, address_line2, city, state, postal_code, country, description, allowed_domains, created_at, updated_at) VALUES ('b2da5b8b-92ec-43f0-9d3f-788db837d067', 'Fremont Pacific Commons', 'Venue', NULL, NULL, NULL, NULL, NULL, NULL, NULL, NULL, NULL, NULL, '2026-02-09 05:19:10.35881+00', '2026-02-09 05:19:10.35881+00');
INSERT INTO organizations (id, name, type, url, phone_number, address_line1, address_line2, city, state, postal_code, country, description, allowed_domains, created_at, updated_at) VALUES ('c2bb6085-e647-4a76-b5f1-6a81d21577ed', 'Grrlztalk', 'Act', NULL, NULL, NULL, NULL, NULL, NULL, NULL, NULL, NULL, NULL, '2026-02-09 05:19:11.038717+00', '2026-02-09 05:19:11.038717+00');
INSERT INTO organizations (id, name, type, url, phone_number, address_line1, address_line2, city, state, postal_code, country, description, allowed_domains, created_at, updated_at) VALUES ('b82328b3-98fe-4db7-964b-b5455e492108', 'Orinda Community Park', 'Venue', NULL, NULL, NULL, NULL, NULL, NULL, NULL, NULL, NULL, NULL, '2026-02-09 05:19:11.410753+00', '2026-02-09 05:19:11.410753+00');
INSERT INTO organizations (id, name, type, url, phone_number, address_line1, address_line2, city, state, postal_code, country, description, allowed_domains, created_at, updated_at) VALUES ('c9761b46-01a7-40dc-bbf2-1d6f034c4707', 'Hipster Cocktail Party', 'Act', NULL, NULL, NULL, NULL, NULL, NULL, NULL, NULL, NULL, NULL, '2026-02-09 05:19:12.416735+00', '2026-02-09 05:19:12.416735+00');
INSERT INTO organizations (id, name, type, url, phone_number, address_line1, address_line2, city, state, postal_code, country, description, allowed_domains, created_at, updated_at) VALUES ('eafca38d-1b02-4572-a287-19c884bc5dd9', 'Patron Latin Band', 'Act', NULL, NULL, NULL, NULL, NULL, NULL, NULL, NULL, NULL, NULL, '2026-02-09 05:19:13.380793+00', '2026-02-09 05:19:13.380793+00');
INSERT INTO organizations (id, name, type, url, phone_number, address_line1, address_line2, city, state, postal_code, country, description, allowed_domains, created_at, updated_at) VALUES ('ba7694d3-7b0e-4bfb-bdad-e21ed05a020b', 'Round Hill Country Club', 'Venue', NULL, NULL, NULL, NULL, NULL, NULL, NULL, NULL, NULL, NULL, '2026-02-09 05:19:13.827268+00', '2026-02-09 05:19:13.827268+00');
INSERT INTO organizations (id, name, type, url, phone_number, address_line1, address_line2, city, state, postal_code, country, description, allowed_domains, created_at, updated_at) VALUES ('1e8b6859-2ac8-470d-be50-8b83c93cdfaa', 'Vintage Jukebox', 'Act', NULL, NULL, NULL, NULL, NULL, NULL, NULL, NULL, NULL, NULL, '2026-02-09 05:19:14.597264+00', '2026-02-09 05:19:14.597264+00');
INSERT INTO organizations (id, name, type, url, phone_number, address_line1, address_line2, city, state, postal_code, country, description, allowed_domains, created_at, updated_at) VALUES ('2bd018a4-6348-4a85-b78d-4446b5107234', 'SF Cruise Boat', 'Venue', NULL, NULL, NULL, NULL, NULL, NULL, NULL, NULL, NULL, NULL, '2026-02-09 05:19:15.152823+00', '2026-02-09 05:19:15.152823+00');
INSERT INTO organizations (id, name, type, url, phone_number, address_line1, address_line2, city, state, postal_code, country, description, allowed_domains, created_at, updated_at) VALUES ('00d50a2a-9c93-409f-8f7a-f4a0677f0451', 'Private', 'Act', NULL, NULL, NULL, NULL, NULL, NULL, NULL, NULL, NULL, NULL, '2026-02-09 05:19:15.693915+00', '2026-02-09 05:19:15.693915+00');
INSERT INTO organizations (id, name, type, url, phone_number, address_line1, address_line2, city, state, postal_code, country, description, allowed_domains, created_at, updated_at) VALUES ('0dc59bb2-b3d4-4d48-86ce-809ec957cfd1', 'Bridges Golf Club', 'Venue', NULL, NULL, NULL, NULL, NULL, NULL, NULL, NULL, NULL, NULL, '2026-02-09 05:19:16.020304+00', '2026-02-09 05:19:16.020304+00');
INSERT INTO organizations (id, name, type, url, phone_number, address_line1, address_line2, city, state, postal_code, country, description, allowed_domains, created_at, updated_at) VALUES ('27e5d12f-0843-4fab-9368-e24077d31d94', 'Last One Picked', 'Act', NULL, NULL, NULL, NULL, NULL, NULL, NULL, NULL, NULL, NULL, '2026-02-09 05:19:16.547685+00', '2026-02-09 05:19:16.547685+00');
INSERT INTO organizations (id, name, type, url, phone_number, address_line1, address_line2, city, state, postal_code, country, description, allowed_domains, created_at, updated_at) VALUES ('fcb7020e-1341-42cb-b6ea-f6423f318055', 'Diablo Country Club', 'Venue', NULL, NULL, NULL, NULL, NULL, NULL, NULL, NULL, NULL, NULL, '2026-02-09 05:19:17.15059+00', '2026-02-09 05:19:17.15059+00');
INSERT INTO organizations (id, name, type, url, phone_number, address_line1, address_line2, city, state, postal_code, country, description, allowed_domains, created_at, updated_at) VALUES ('93544cfe-c4d8-4566-8748-b3964a56cabb', 'Del Valle Winery', 'Venue', NULL, NULL, NULL, NULL, NULL, NULL, NULL, NULL, NULL, NULL, '2026-02-09 05:19:17.676264+00', '2026-02-09 05:19:17.676264+00');
INSERT INTO organizations (id, name, type, url, phone_number, address_line1, address_line2, city, state, postal_code, country, description, allowed_domains, created_at, updated_at) VALUES ('f2427546-4b6c-42f9-aed5-90abfe849f2c', 'Foreverland', 'Act', NULL, NULL, NULL, NULL, NULL, NULL, NULL, NULL, NULL, NULL, '2026-02-09 05:19:18.153325+00', '2026-02-09 05:19:18.153325+00');
INSERT INTO organizations (id, name, type, url, phone_number, address_line1, address_line2, city, state, postal_code, country, description, allowed_domains, created_at, updated_at) VALUES ('c32ae626-73ab-473d-96e8-a5c6eda48c2f', 'Marriott San Ramon', 'Venue', NULL, NULL, NULL, NULL, NULL, NULL, NULL, NULL, NULL, NULL, '2026-02-09 05:19:19.030492+00', '2026-02-09 05:19:19.030492+00');
INSERT INTO organizations (id, name, type, url, phone_number, address_line1, address_line2, city, state, postal_code, country, description, allowed_domains, created_at, updated_at) VALUES ('9611345f-c691-4f43-bba8-76433392a16a', 'Bray and the Dens', 'Act', NULL, NULL, NULL, NULL, NULL, NULL, NULL, NULL, NULL, NULL, '2026-02-09 05:19:20.030213+00', '2026-02-09 05:19:20.030213+00');
INSERT INTO organizations (id, name, type, url, phone_number, address_line1, address_line2, city, state, postal_code, country, description, allowed_domains, created_at, updated_at) VALUES ('cfc55db2-2e8e-4784-98f3-6497566939e5', 'Club Fox', 'Venue', NULL, NULL, NULL, NULL, NULL, NULL, NULL, NULL, NULL, NULL, '2026-02-09 05:19:20.387175+00', '2026-02-09 05:19:20.387175+00');
INSERT INTO organizations (id, name, type, url, phone_number, address_line1, address_line2, city, state, postal_code, country, description, allowed_domains, created_at, updated_at) VALUES ('61a3734a-2c82-4923-8ad4-943e3759fdf3', 'Redneck Prom', 'Act', NULL, NULL, NULL, NULL, NULL, NULL, NULL, NULL, NULL, NULL, '2026-02-09 05:19:20.868559+00', '2026-02-09 05:19:20.868559+00');
INSERT INTO organizations (id, name, type, url, phone_number, address_line1, address_line2, city, state, postal_code, country, description, allowed_domains, created_at, updated_at) VALUES ('8ecffb09-1347-40eb-8923-87f467448087', 'Auburn', 'Venue', NULL, NULL, NULL, NULL, NULL, NULL, NULL, NULL, NULL, NULL, '2026-02-09 05:19:21.256479+00', '2026-02-09 05:19:21.256479+00');
INSERT INTO organizations (id, name, type, url, phone_number, address_line1, address_line2, city, state, postal_code, country, description, allowed_domains, created_at, updated_at) VALUES ('f59fa3ea-aeca-4fa6-b099-42a0deaf06aa', 'Mike Hess Brewery', 'Venue', NULL, NULL, NULL, NULL, NULL, NULL, NULL, NULL, NULL, NULL, '2026-02-09 05:19:22.074208+00', '2026-02-09 05:19:22.074208+00');
INSERT INTO organizations (id, name, type, url, phone_number, address_line1, address_line2, city, state, postal_code, country, description, allowed_domains, created_at, updated_at) VALUES ('e959aeb8-1f0a-41f2-a469-c8ee0f7579c1', 'Growler', 'Venue', NULL, NULL, NULL, NULL, NULL, NULL, NULL, NULL, NULL, NULL, '2026-02-09 05:19:23.83073+00', '2026-02-09 05:19:23.83073+00');
INSERT INTO organizations (id, name, type, url, phone_number, address_line1, address_line2, city, state, postal_code, country, description, allowed_domains, created_at, updated_at) VALUES ('1ab6341b-4f95-4949-8135-814765239612', 'Various Acts', 'Act', NULL, NULL, NULL, NULL, NULL, NULL, NULL, NULL, NULL, NULL, '2026-02-09 05:19:24.311122+00', '2026-02-09 05:19:24.311122+00');
INSERT INTO organizations (id, name, type, url, phone_number, address_line1, address_line2, city, state, postal_code, country, description, allowed_domains, created_at, updated_at) VALUES ('efc6f1e0-c7b2-4604-994a-4ef60b4b0f16', 'Powerplay', 'Act', NULL, NULL, NULL, NULL, NULL, NULL, NULL, NULL, NULL, NULL, '2026-02-09 05:19:26.140515+00', '2026-02-09 05:19:26.140515+00');
INSERT INTO organizations (id, name, type, url, phone_number, address_line1, address_line2, city, state, postal_code, country, description, allowed_domains, created_at, updated_at) VALUES ('f35933a2-5424-425f-b8d2-d84647ff5ba7', 'Campolindo High School', 'Venue', NULL, NULL, NULL, NULL, NULL, NULL, NULL, NULL, NULL, NULL, '2026-02-09 05:19:27.356675+00', '2026-02-09 05:19:27.356675+00');
INSERT INTO organizations (id, name, type, url, phone_number, address_line1, address_line2, city, state, postal_code, country, description, allowed_domains, created_at, updated_at) VALUES ('a58456bc-5bcd-488c-8345-3c3e3d311cbe', 'Summer Concerts', 'Act', NULL, NULL, NULL, NULL, NULL, NULL, NULL, NULL, NULL, NULL, '2026-02-09 05:19:28.878681+00', '2026-02-09 05:19:28.878681+00');
INSERT INTO organizations (id, name, type, url, phone_number, address_line1, address_line2, city, state, postal_code, country, description, allowed_domains, created_at, updated_at) VALUES ('e98bb8af-1346-4cd4-bd13-b5cc86bd70b9', 'Art & Wine Festival', 'Act', NULL, NULL, NULL, NULL, NULL, NULL, NULL, NULL, NULL, NULL, '2026-02-09 05:19:31.57217+00', '2026-02-09 05:19:31.57217+00');
INSERT INTO organizations (id, name, type, url, phone_number, address_line1, address_line2, city, state, postal_code, country, description, allowed_domains, created_at, updated_at) VALUES ('5efa2f7b-f8d3-495a-8da5-56ca58050ea2', 'Lafayette', 'Venue', NULL, NULL, NULL, NULL, NULL, NULL, NULL, NULL, NULL, NULL, '2026-02-09 05:19:31.88071+00', '2026-02-09 05:19:31.88071+00');


--
-- Data for Name: assets; Type: TABLE DATA; Schema: public; Owner: postgres
--

INSERT INTO assets (id, organization_id, acquisition_date, vendor, cost, category, sub_category, insurance_policy_added, manufacturer_model, type, serial_number, description, replacement_value, insurance_class, quantity, created_by, updated_by, created_at, updated_at) VALUES ('ecd5f7b2-c1c2-40fe-91eb-9820eefcfa00', '09fca024-b5c1-4f81-a71b-a68361548948', '2025-05-19', 'Pro Audio World', '2200.00', 'Audio', 'Speaker', 'f', 'RCF SUB-8003', 'Powered Subwoofer', '', 'RCF Subwoofer, Casters and Cover.', '2600.00', 'E', '2', 'd0a35726-0993-40b4-b41d-c61806a4670e', 'd0a35726-0993-40b4-b41d-c61806a4670e', '2025-11-20 22:25:46.263348+00', '2025-11-21 01:45:53.427273+00');
INSERT INTO assets (id, organization_id, acquisition_date, vendor, cost, category, sub_category, insurance_policy_added, manufacturer_model, type, serial_number, description, replacement_value, insurance_class, quantity, created_by, updated_by, created_at, updated_at) VALUES ('10d36935-c6e6-4072-8906-c755d5cbd9d9', '09fca024-b5c1-4f81-a71b-a68361548948', '2024-01-15', 'Audio Vendor Inc', '94.50', 'Audio', 'Microphones', 'f', 'Shure SM58', 'Dynamic Microphone', 'SN123456', 'Notes about the asset', '100.00', 'A', '2', 'd0a35726-0993-40b4-b41d-c61806a4670e', 'aa545fd3-e827-40d0-a017-1d35b5f42aa9', '2025-11-21 02:26:12.256834+00', '2026-01-31 06:48:48.575459+00');
INSERT INTO assets (id, organization_id, acquisition_date, vendor, cost, category, sub_category, insurance_policy_added, manufacturer_model, type, serial_number, description, replacement_value, insurance_class, quantity, created_by, updated_by, created_at, updated_at) VALUES ('800e1842-ce2c-454b-a6ea-b458a564f8ba', '09fca024-b5c1-4f81-a71b-a68361548948', '2025-08-03', 'Pro Audio World', '2200.00', 'Audio', 'Speaker', 'f', 'RCF NX 932-A', 'Powered Speaker', NULL, 'This is a _great_ speaker!', '2200.00', 'E', '2', '7e7e8ad7-6951-4dc4-8310-eff2f1b30060', 'aa545fd3-e827-40d0-a017-1d35b5f42aa9', '2025-11-13 07:05:38.800809+00', '2026-01-31 14:45:13.202668+00');


--
-- Data for Name: gigs; Type: TABLE DATA; Schema: public; Owner: postgres
--

INSERT INTO gigs (id, title, status, tags, start, "end", timezone, notes, parent_gig_id, hierarchy_depth, created_by, updated_by, created_at, updated_at) VALUES ('892ab327-b80d-4657-b47b-fffbf8750b74', 'Earth, Wind & Fire @ Fox Theatre 6/26/2025', 'Completed', '{Stage}', '2025-06-26 12:00:00+00', '2025-06-26 12:00:00+00', 'America/Los_Angeles', NULL, NULL, '0', 'aa545fd3-e827-40d0-a017-1d35b5f42aa9', 'aa545fd3-e827-40d0-a017-1d35b5f42aa9', '2026-02-09 08:09:41.25944+00', '2026-02-09 08:09:41.25944+00');
INSERT INTO gigs (id, title, status, tags, start, "end", timezone, notes, parent_gig_id, hierarchy_depth, created_by, updated_by, created_at, updated_at) VALUES ('ecd68d89-0a1b-4e45-8208-91bda132a694', 'Cheeseballs @ Fremont 6/27/2025', 'Completed', '{Stage}', '2025-06-27 12:00:00+00', '2025-06-27 12:00:00+00', 'America/Los_Angeles', NULL, NULL, '0', 'aa545fd3-e827-40d0-a017-1d35b5f42aa9', 'aa545fd3-e827-40d0-a017-1d35b5f42aa9', '2026-02-09 08:09:41.62187+00', '2026-02-09 08:09:41.62187+00');
INSERT INTO gigs (id, title, status, tags, start, "end", timezone, notes, parent_gig_id, hierarchy_depth, created_by, updated_by, created_at, updated_at) VALUES ('f9848f9e-9768-4707-8577-ba52c2ba52ba', 'Midnight Reruns @ Norm''s 7/3/2025', 'Completed', '{Lights,PA}', '2025-07-03 12:00:00+00', '2025-07-03 12:00:00+00', 'America/Los_Angeles', 'Loadin: 5pm, SC: 6:30, Set: 8:00', NULL, '0', 'aa545fd3-e827-40d0-a017-1d35b5f42aa9', 'aa545fd3-e827-40d0-a017-1d35b5f42aa9', '2026-02-09 08:09:41.94913+00', '2026-02-09 08:09:41.94913+00');
INSERT INTO gigs (id, title, status, tags, start, "end", timezone, notes, parent_gig_id, hierarchy_depth, created_by, updated_by, created_at, updated_at) VALUES ('4eb3e09c-f88d-48b9-a0c6-c26532202a80', 'Grrlztalk @ Orinda Park 7/24/2025', 'Completed', '{PA}', '2025-07-24 12:00:00+00', '2025-07-24 12:00:00+00', 'America/Los_Angeles', 'Mel Speed gig -- He provides FOH speakers.  Needs sound tech and mixer.  2 hours in Orinda 6:00 PM - 8:00 PM (Setup 4pm)', NULL, '0', 'aa545fd3-e827-40d0-a017-1d35b5f42aa9', 'aa545fd3-e827-40d0-a017-1d35b5f42aa9', '2026-02-09 08:09:42.301334+00', '2026-02-09 08:09:42.301334+00');
INSERT INTO gigs (id, title, status, tags, start, "end", timezone, notes, parent_gig_id, hierarchy_depth, created_by, updated_by, created_at, updated_at) VALUES ('9118bc4a-7794-4ebe-b338-d2e468e0bfc6', 'Midnight Reruns @ Meenar''s 9/14/2024', 'Completed', '{Mixing}', '2024-09-14 12:00:00+00', '2024-09-14 12:00:00+00', 'America/Los_Angeles', NULL, NULL, '0', 'aa545fd3-e827-40d0-a017-1d35b5f42aa9', 'aa545fd3-e827-40d0-a017-1d35b5f42aa9', '2026-02-09 08:09:34.022515+00', '2026-02-09 08:09:34.022515+00');
INSERT INTO gigs (id, title, status, tags, start, "end", timezone, notes, parent_gig_id, hierarchy_depth, created_by, updated_by, created_at, updated_at) VALUES ('b59b5e7d-a3a4-4a26-8f4f-55026baa2c21', 'Midnight Reruns @ Private 10/2/2024', 'Completed', '{Mixing}', '2024-10-02 12:00:00+00', '2024-10-02 12:00:00+00', 'America/Los_Angeles', NULL, NULL, '0', 'aa545fd3-e827-40d0-a017-1d35b5f42aa9', 'aa545fd3-e827-40d0-a017-1d35b5f42aa9', '2026-02-09 08:09:34.395651+00', '2026-02-09 08:09:34.395651+00');
INSERT INTO gigs (id, title, status, tags, start, "end", timezone, notes, parent_gig_id, hierarchy_depth, created_by, updated_by, created_at, updated_at) VALUES ('de68c30d-3e29-445a-ae9d-e2fb2819eff4', 'Blue Valley @ Las Positas 10/11/2024', 'Completed', '{Mixing}', '2024-10-11 12:00:00+00', '2024-10-11 12:00:00+00', 'America/Los_Angeles', NULL, NULL, '0', 'aa545fd3-e827-40d0-a017-1d35b5f42aa9', 'aa545fd3-e827-40d0-a017-1d35b5f42aa9', '2026-02-09 08:09:34.764764+00', '2026-02-09 08:09:34.764764+00');
INSERT INTO gigs (id, title, status, tags, start, "end", timezone, notes, parent_gig_id, hierarchy_depth, created_by, updated_by, created_at, updated_at) VALUES ('63f0e500-cc53-4193-81cf-37d3fd0d17db', 'Blue Valley @ Meenar''s 11/16/2024', 'Completed', '{Mixing}', '2024-11-16 12:00:00+00', '2024-11-16 12:00:00+00', 'America/Los_Angeles', NULL, NULL, '0', 'aa545fd3-e827-40d0-a017-1d35b5f42aa9', 'aa545fd3-e827-40d0-a017-1d35b5f42aa9', '2026-02-09 08:09:35.080353+00', '2026-02-09 08:09:35.080353+00');
INSERT INTO gigs (id, title, status, tags, start, "end", timezone, notes, parent_gig_id, hierarchy_depth, created_by, updated_by, created_at, updated_at) VALUES ('dafabf70-b8d1-43b7-93dd-f5373ea22256', 'Blue Valley @ Dan''s 12/7/2024', 'Completed', '{Mixing}', '2024-12-07 12:00:00+00', '2024-12-07 12:00:00+00', 'America/Los_Angeles', NULL, NULL, '0', 'aa545fd3-e827-40d0-a017-1d35b5f42aa9', 'aa545fd3-e827-40d0-a017-1d35b5f42aa9', '2026-02-09 08:09:35.428865+00', '2026-02-09 08:09:35.428865+00');
INSERT INTO gigs (id, title, status, tags, start, "end", timezone, notes, parent_gig_id, hierarchy_depth, created_by, updated_by, created_at, updated_at) VALUES ('5796bd45-00e7-4d3d-985a-fad7c9d96165', 'Mixed Nuts @ Pleasant Hill CC 2/22/2025', 'Completed', '{Lights,Mixing,PA}', '2025-02-22 12:00:00+00', '2025-02-22 12:00:00+00', 'America/Los_Angeles', NULL, NULL, '0', 'aa545fd3-e827-40d0-a017-1d35b5f42aa9', 'aa545fd3-e827-40d0-a017-1d35b5f42aa9', '2026-02-09 08:09:35.801144+00', '2026-02-09 08:09:35.801144+00');
INSERT INTO gigs (id, title, status, tags, start, "end", timezone, notes, parent_gig_id, hierarchy_depth, created_by, updated_by, created_at, updated_at) VALUES ('2787f16b-d4b0-4476-bb3d-2bcbb1b4cb2b', 'Spazmatics @ Dan''s 2/28/2025', 'Cancelled', '{Cancelled,Lights}', '2025-02-28 12:00:00+00', '2025-02-28 12:00:00+00', 'America/Los_Angeles', NULL, NULL, '0', 'aa545fd3-e827-40d0-a017-1d35b5f42aa9', 'aa545fd3-e827-40d0-a017-1d35b5f42aa9', '2026-02-09 08:09:36.159491+00', '2026-02-09 08:09:36.159491+00');
INSERT INTO gigs (id, title, status, tags, start, "end", timezone, notes, parent_gig_id, hierarchy_depth, created_by, updated_by, created_at, updated_at) VALUES ('e80b78d5-1ca8-436d-a2e0-25c7a412bc3d', 'Revive @ Creekside 3/2/2025', 'Completed', '{Mixing,Revive}', '2025-03-02 12:00:00+00', '2025-03-02 12:00:00+00', 'America/Los_Angeles', NULL, NULL, '0', 'aa545fd3-e827-40d0-a017-1d35b5f42aa9', 'aa545fd3-e827-40d0-a017-1d35b5f42aa9', '2026-02-09 08:09:36.492063+00', '2026-02-09 08:09:36.492063+00');
INSERT INTO gigs (id, title, status, tags, start, "end", timezone, notes, parent_gig_id, hierarchy_depth, created_by, updated_by, created_at, updated_at) VALUES ('daca5a7d-b28e-484b-ab6d-851905fbf332', 'Midnight Reruns @ Meenar''s 3/15/2025', 'Completed', '{Lights,PA}', '2025-03-15 12:00:00+00', '2025-03-15 12:00:00+00', 'America/Los_Angeles', NULL, NULL, '0', 'aa545fd3-e827-40d0-a017-1d35b5f42aa9', 'aa545fd3-e827-40d0-a017-1d35b5f42aa9', '2026-02-09 08:09:36.724729+00', '2026-02-09 08:09:36.724729+00');
INSERT INTO gigs (id, title, status, tags, start, "end", timezone, notes, parent_gig_id, hierarchy_depth, created_by, updated_by, created_at, updated_at) VALUES ('a6faf07b-6c52-41f9-89ad-d981a6dcc767', 'Robert, Music @ Pioneer Saloon 3/27/2025', 'Completed', '{Lights,PA}', '2025-03-27 12:00:00+00', '2025-03-27 12:00:00+00', 'America/Los_Angeles', NULL, NULL, '0', 'aa545fd3-e827-40d0-a017-1d35b5f42aa9', 'aa545fd3-e827-40d0-a017-1d35b5f42aa9', '2026-02-09 08:09:37.081893+00', '2026-02-09 08:09:37.081893+00');
INSERT INTO gigs (id, title, status, tags, start, "end", timezone, notes, parent_gig_id, hierarchy_depth, created_by, updated_by, created_at, updated_at) VALUES ('bb4b03d7-d200-4730-ab00-82dce5696de2', 'Midnight Reruns @ Norm''s 4/4/2025', 'Completed', '{Lights,PA}', '2025-04-04 12:00:00+00', '2025-04-04 12:00:00+00', 'America/Los_Angeles', NULL, NULL, '0', 'aa545fd3-e827-40d0-a017-1d35b5f42aa9', 'aa545fd3-e827-40d0-a017-1d35b5f42aa9', '2026-02-09 08:09:37.425138+00', '2026-02-09 08:09:37.425138+00');
INSERT INTO gigs (id, title, status, tags, start, "end", timezone, notes, parent_gig_id, hierarchy_depth, created_by, updated_by, created_at, updated_at) VALUES ('0d93880b-4c73-4e00-bd43-e94f73b7beee', 'Spazmatics @ Lafayette Theatre 4/11/2025', 'Completed', '{Stage}', '2025-04-11 12:00:00+00', '2025-04-11 12:00:00+00', 'America/Los_Angeles', NULL, NULL, '0', 'aa545fd3-e827-40d0-a017-1d35b5f42aa9', 'aa545fd3-e827-40d0-a017-1d35b5f42aa9', '2026-02-09 08:09:37.747868+00', '2026-02-09 08:09:37.747868+00');
INSERT INTO gigs (id, title, status, tags, start, "end", timezone, notes, parent_gig_id, hierarchy_depth, created_by, updated_by, created_at, updated_at) VALUES ('4b0ac1f6-aff6-4118-83ad-3d4b60fea4aa', 'Revive @ Creekside 4/18/2025', 'Completed', '{Mixing,Revive}', '2025-04-18 12:00:00+00', '2025-04-18 12:00:00+00', 'America/Los_Angeles', NULL, NULL, '0', 'aa545fd3-e827-40d0-a017-1d35b5f42aa9', 'aa545fd3-e827-40d0-a017-1d35b5f42aa9', '2026-02-09 08:09:38.050002+00', '2026-02-09 08:09:38.050002+00');
INSERT INTO gigs (id, title, status, tags, start, "end", timezone, notes, parent_gig_id, hierarchy_depth, created_by, updated_by, created_at, updated_at) VALUES ('d126c89c-c02e-40c7-84a6-378e859bd1d4', 'Fleetwood Macrame  @ Private 5/3/2025', 'Completed', '{Stage}', '2025-05-03 12:00:00+00', '2025-05-03 12:00:00+00', 'America/Los_Angeles', 'https://docs.google.com/document/d/1Y1BltDjdrXcfsJA_51YTcbg11q4UKG4cRG6o4vus7rI/edit?usp=sharing', NULL, '0', 'aa545fd3-e827-40d0-a017-1d35b5f42aa9', 'aa545fd3-e827-40d0-a017-1d35b5f42aa9', '2026-02-09 08:09:38.310903+00', '2026-02-09 08:09:38.310903+00');
INSERT INTO gigs (id, title, status, tags, start, "end", timezone, notes, parent_gig_id, hierarchy_depth, created_by, updated_by, created_at, updated_at) VALUES ('429dba77-edf3-42d7-8011-3ecd74066463', 'Neon Velvet @ Private 5/9/2025', 'Completed', '{Stage}', '2025-05-09 12:00:00+00', '2025-05-09 12:00:00+00', 'America/Los_Angeles', NULL, NULL, '0', 'aa545fd3-e827-40d0-a017-1d35b5f42aa9', 'aa545fd3-e827-40d0-a017-1d35b5f42aa9', '2026-02-09 08:09:38.655489+00', '2026-02-09 08:09:38.655489+00');
INSERT INTO gigs (id, title, status, tags, start, "end", timezone, notes, parent_gig_id, hierarchy_depth, created_by, updated_by, created_at, updated_at) VALUES ('736530f1-ac9c-45b1-814e-384102b3d24b', 'Neon Velvet @ Gold Bar 5/17/2025', 'Completed', '{Stage}', '2025-05-17 12:00:00+00', '2025-05-17 12:00:00+00', 'America/Los_Angeles', 'https://docs.google.com/document/d/1YwkXgtuVZl_lk53TnDHC2lbG5uXzhQNbjnVxlTKaiF4/edit?usp=sharing', NULL, '0', 'aa545fd3-e827-40d0-a017-1d35b5f42aa9', 'aa545fd3-e827-40d0-a017-1d35b5f42aa9', '2026-02-09 08:09:38.984788+00', '2026-02-09 08:09:38.984788+00');
INSERT INTO gigs (id, title, status, tags, start, "end", timezone, notes, parent_gig_id, hierarchy_depth, created_by, updated_by, created_at, updated_at) VALUES ('1aee5e52-1b9a-41b6-ad68-74988a827014', 'Midnight Reruns @ Hazy 5/23/2025', 'Completed', '{PA}', '2025-05-23 12:00:00+00', '2025-05-23 12:00:00+00', 'America/Los_Angeles', NULL, NULL, '0', 'aa545fd3-e827-40d0-a017-1d35b5f42aa9', 'aa545fd3-e827-40d0-a017-1d35b5f42aa9', '2026-02-09 08:09:39.333404+00', '2026-02-09 08:09:39.333404+00');
INSERT INTO gigs (id, title, status, tags, start, "end", timezone, notes, parent_gig_id, hierarchy_depth, created_by, updated_by, created_at, updated_at) VALUES ('223bb868-3ce8-4ee5-a39b-27016605ddb7', 'Blue Valley @ Las Positas 5/30/2025', 'Completed', '{Mixing}', '2025-05-30 12:00:00+00', '2025-05-30 12:00:00+00', 'America/Los_Angeles', '4pm setup, 6pm start, 8:30 hard stop', NULL, '0', 'aa545fd3-e827-40d0-a017-1d35b5f42aa9', 'aa545fd3-e827-40d0-a017-1d35b5f42aa9', '2026-02-09 08:09:39.618169+00', '2026-02-09 08:09:39.618169+00');
INSERT INTO gigs (id, title, status, tags, start, "end", timezone, notes, parent_gig_id, hierarchy_depth, created_by, updated_by, created_at, updated_at) VALUES ('655e8ad0-f20b-42c8-b9a3-af6cfed9bc97', 'Milbourne Sound @ WC Art-n-Wine 5/31/2025', 'Completed', '{Mixing}', '2025-05-31 12:00:00+00', '2025-05-31 12:00:00+00', 'America/Los_Angeles', NULL, NULL, '0', 'aa545fd3-e827-40d0-a017-1d35b5f42aa9', 'aa545fd3-e827-40d0-a017-1d35b5f42aa9', '2026-02-09 08:09:39.970839+00', '2026-02-09 08:09:39.970839+00');
INSERT INTO gigs (id, title, status, tags, start, "end", timezone, notes, parent_gig_id, hierarchy_depth, created_by, updated_by, created_at, updated_at) VALUES ('aeeb2919-1fb1-403b-b943-ce0e22a9175f', 'Milbourne Sound @ WC Art-n-Wine 6/1/2025', 'Completed', '{Mixing}', '2025-06-01 12:00:00+00', '2025-06-01 12:00:00+00', 'America/Los_Angeles', NULL, NULL, '0', 'aa545fd3-e827-40d0-a017-1d35b5f42aa9', 'aa545fd3-e827-40d0-a017-1d35b5f42aa9', '2026-02-09 08:09:40.257459+00', '2026-02-09 08:09:40.257459+00');
INSERT INTO gigs (id, title, status, tags, start, "end", timezone, notes, parent_gig_id, hierarchy_depth, created_by, updated_by, created_at, updated_at) VALUES ('73aaa3cc-fb44-40c6-89af-bed03146a96d', 'Neon Velvet @ Redwood City Music 6/13/2025', 'Completed', '{Stage}', '2025-06-13 12:00:00+00', '2025-06-13 12:00:00+00', 'America/Los_Angeles', '6pm to 8:30', NULL, '0', 'aa545fd3-e827-40d0-a017-1d35b5f42aa9', 'aa545fd3-e827-40d0-a017-1d35b5f42aa9', '2026-02-09 08:09:40.617252+00', '2026-02-09 08:09:40.617252+00');
INSERT INTO gigs (id, title, status, tags, start, "end", timezone, notes, parent_gig_id, hierarchy_depth, created_by, updated_by, created_at, updated_at) VALUES ('27b08b7c-ca9f-4588-8674-02b85aa18795', 'Blue Valley @ Hazy 6/14/2025', 'Completed', '{PA}', '2025-06-14 12:00:00+00', '2025-06-14 12:00:00+00', 'America/Los_Angeles', NULL, NULL, '0', 'aa545fd3-e827-40d0-a017-1d35b5f42aa9', 'aa545fd3-e827-40d0-a017-1d35b5f42aa9', '2026-02-09 08:09:40.897249+00', '2026-02-09 08:09:40.897249+00');
INSERT INTO gigs (id, title, status, tags, start, "end", timezone, notes, parent_gig_id, hierarchy_depth, created_by, updated_by, created_at, updated_at) VALUES ('d430cabd-f85d-437f-ace2-0d53b567d5d4', 'Fleetwood Macrame  @ Fremont 7/25/2025', 'Completed', '{Stage}', '2025-07-25 12:00:00+00', '2025-07-25 12:00:00+00', 'America/Los_Angeles', NULL, NULL, '0', 'aa545fd3-e827-40d0-a017-1d35b5f42aa9', 'aa545fd3-e827-40d0-a017-1d35b5f42aa9', '2026-02-09 08:09:42.585805+00', '2026-02-09 08:09:42.585805+00');
INSERT INTO gigs (id, title, status, tags, start, "end", timezone, notes, parent_gig_id, hierarchy_depth, created_by, updated_by, created_at, updated_at) VALUES ('5800bc44-2d74-45c2-9aea-6f37f1663c94', 'Revive @ Creekside 8/2/2025', 'Completed', '{Lights,Mixing,Revive}', '2025-08-02 12:00:00+00', '2025-08-02 12:00:00+00', 'America/Los_Angeles', 'On Lawn', NULL, '0', 'aa545fd3-e827-40d0-a017-1d35b5f42aa9', 'aa545fd3-e827-40d0-a017-1d35b5f42aa9', '2026-02-09 08:09:42.868806+00', '2026-02-09 08:09:42.868806+00');
INSERT INTO gigs (id, title, status, tags, start, "end", timezone, notes, parent_gig_id, hierarchy_depth, created_by, updated_by, created_at, updated_at) VALUES ('754a8c8f-6571-49a5-bfb9-4cab546b2b52', 'Hipster Cocktail Party @ Orinda Park 8/7/2025', 'Completed', '{PA}', '2025-08-07 12:00:00+00', '2025-08-07 12:00:00+00', 'America/Los_Angeles', 'Mel Speed gig -- He provides FOH speakers.  Needs sound tech and mixer.  2 hours in Orinda 6:00 PM - 8:00 PM (Setup 4pm)', NULL, '0', 'aa545fd3-e827-40d0-a017-1d35b5f42aa9', 'aa545fd3-e827-40d0-a017-1d35b5f42aa9', '2026-02-09 08:09:43.142269+00', '2026-02-09 08:09:43.142269+00');
INSERT INTO gigs (id, title, status, tags, start, "end", timezone, notes, parent_gig_id, hierarchy_depth, created_by, updated_by, created_at, updated_at) VALUES ('df03f2e6-f50b-46d6-8f6e-1725c6926509', 'Midnight Reruns @ Hazy 8/8/2025', 'Completed', '{Lights,PA}', '2025-08-08 12:00:00+00', '2025-08-08 12:00:00+00', 'America/Los_Angeles', NULL, NULL, '0', 'aa545fd3-e827-40d0-a017-1d35b5f42aa9', 'aa545fd3-e827-40d0-a017-1d35b5f42aa9', '2026-02-09 08:09:43.445972+00', '2026-02-09 08:09:43.445972+00');
INSERT INTO gigs (id, title, status, tags, start, "end", timezone, notes, parent_gig_id, hierarchy_depth, created_by, updated_by, created_at, updated_at) VALUES ('7168fe81-7290-4daf-8d16-19971965f907', 'Midnight Reruns @ Private 8/9/2025', 'Completed', '{Lights,PA}', '2025-08-09 12:00:00+00', '2025-08-09 12:00:00+00', 'America/Los_Angeles', NULL, NULL, '0', 'aa545fd3-e827-40d0-a017-1d35b5f42aa9', 'aa545fd3-e827-40d0-a017-1d35b5f42aa9', '2026-02-09 08:09:43.766477+00', '2026-02-09 08:09:43.766477+00');
INSERT INTO gigs (id, title, status, tags, start, "end", timezone, notes, parent_gig_id, hierarchy_depth, created_by, updated_by, created_at, updated_at) VALUES ('bc241120-b2af-4439-8373-65ea20929256', 'Patron Latin Band @ Fremont 8/22/2025', 'Completed', '{Stage}', '2025-08-22 12:00:00+00', '2025-08-22 12:00:00+00', 'America/Los_Angeles', NULL, NULL, '0', 'aa545fd3-e827-40d0-a017-1d35b5f42aa9', 'aa545fd3-e827-40d0-a017-1d35b5f42aa9', '2026-02-09 08:09:44.09379+00', '2026-02-09 08:09:44.09379+00');
INSERT INTO gigs (id, title, status, tags, start, "end", timezone, notes, parent_gig_id, hierarchy_depth, created_by, updated_by, created_at, updated_at) VALUES ('01f4f413-70a2-404f-b9a9-c97eb937b5a8', 'Midnight Reruns @ Round Hill CC 8/23/2025', 'Completed', '{Lights,PA}', '2025-08-23 12:00:00+00', '2025-08-23 12:00:00+00', 'America/Los_Angeles', '$280 + $30.24 Reimbursement for Van + ($111 of the $213.95 tax reimb)', NULL, '0', 'aa545fd3-e827-40d0-a017-1d35b5f42aa9', 'aa545fd3-e827-40d0-a017-1d35b5f42aa9', '2026-02-09 08:09:44.417247+00', '2026-02-09 08:09:44.417247+00');
INSERT INTO gigs (id, title, status, tags, start, "end", timezone, notes, parent_gig_id, hierarchy_depth, created_by, updated_by, created_at, updated_at) VALUES ('17147147-5674-47c5-9d82-570e714b2111', 'Midnight Reruns @ Round Hill CC 8/28/2025', 'Proposed', '{Conflict,PA}', '2025-08-28 12:00:00+00', '2025-08-28 12:00:00+00', 'America/Los_Angeles', 'Acoustic Gig (Nick & Alex)', NULL, '0', 'aa545fd3-e827-40d0-a017-1d35b5f42aa9', 'aa545fd3-e827-40d0-a017-1d35b5f42aa9', '2026-02-09 08:09:44.706332+00', '2026-02-09 08:09:44.706332+00');
INSERT INTO gigs (id, title, status, tags, start, "end", timezone, notes, parent_gig_id, hierarchy_depth, created_by, updated_by, created_at, updated_at) VALUES ('88c94db7-42b9-456d-b0b7-50cb7737cd80', 'Vintage Jukebox @ Orinda Park 8/28/2025', 'Completed', '{PA}', '2025-08-28 12:00:00+00', '2025-08-28 12:00:00+00', 'America/Los_Angeles', 'Mel Speed gig -- He provides FOH speakers.  Needs sound tech and mixer.  2 hours in Orinda 6:00 PM - 8:00 PM (Setup 4pm)', NULL, '0', 'aa545fd3-e827-40d0-a017-1d35b5f42aa9', 'aa545fd3-e827-40d0-a017-1d35b5f42aa9', '2026-02-09 08:09:44.980966+00', '2026-02-09 08:09:44.980966+00');
INSERT INTO gigs (id, title, status, tags, start, "end", timezone, notes, parent_gig_id, hierarchy_depth, created_by, updated_by, created_at, updated_at) VALUES ('c52dbd70-98d9-44cd-913b-decfea646b20', 'Midnight Reruns @ Diablo CC 9/12/2025', 'Completed', '{Lights,PA}', '2025-09-12 12:00:00+00', '2025-09-12 12:00:00+00', 'America/Los_Angeles', 'PA load in 10:30. Band load in 11:30, soundcheck 12:45, quiet stage 1:30. Band 3 to 5pm. Minimal light setup.', NULL, '0', 'aa545fd3-e827-40d0-a017-1d35b5f42aa9', 'aa545fd3-e827-40d0-a017-1d35b5f42aa9', '2026-02-09 08:09:46.380578+00', '2026-02-09 08:09:46.380578+00');
INSERT INTO gigs (id, title, status, tags, start, "end", timezone, notes, parent_gig_id, hierarchy_depth, created_by, updated_by, created_at, updated_at) VALUES ('c6beab7e-948a-4d76-a628-9b12e6394226', 'Milbourne Sound @ SR Marriott 10/2/2025', 'Completed', '{Stage}', '2025-10-02 12:00:00+00', '2025-10-02 12:00:00+00', 'America/Los_Angeles', NULL, NULL, '0', 'aa545fd3-e827-40d0-a017-1d35b5f42aa9', 'aa545fd3-e827-40d0-a017-1d35b5f42aa9', '2026-02-09 08:09:47.679134+00', '2026-02-09 08:09:47.679134+00');
INSERT INTO gigs (id, title, status, tags, start, "end", timezone, notes, parent_gig_id, hierarchy_depth, created_by, updated_by, created_at, updated_at) VALUES ('4d2f3b80-1aad-440c-a3d2-4c24fe03727a', 'Redneck Prom @  10/23/2025', 'Completed', '{Stage}', '2025-10-23 12:00:00+00', '2025-10-23 12:00:00+00', 'America/Los_Angeles', 'Redneck Prom (Auburn)', NULL, '0', 'aa545fd3-e827-40d0-a017-1d35b5f42aa9', 'aa545fd3-e827-40d0-a017-1d35b5f42aa9', '2026-02-09 08:09:49.040337+00', '2026-02-09 08:09:49.040337+00');
INSERT INTO gigs (id, title, status, tags, start, "end", timezone, notes, parent_gig_id, hierarchy_depth, created_by, updated_by, created_at, updated_at) VALUES ('158843aa-888c-418e-9e2b-cd216d55d56f', 'Spazmatics @ Dan''s 3/20/2026', 'Booked', '{PA,Lights}', '2026-03-20 12:00:00+00', '2026-03-20 12:00:00+00', 'America/Los_Angeles', NULL, NULL, '0', 'aa545fd3-e827-40d0-a017-1d35b5f42aa9', 'aa545fd3-e827-40d0-a017-1d35b5f42aa9', '2026-02-09 08:09:52.688724+00', '2026-02-09 08:09:52.688724+00');
INSERT INTO gigs (id, title, status, tags, start, "end", timezone, notes, parent_gig_id, hierarchy_depth, created_by, updated_by, created_at, updated_at) VALUES ('0d2c365d-1404-4b88-ba3a-d79f4669a655', 'Revive @ Creekside 5/17/2026', 'Proposed', '{Cancelled}', '2026-05-17 12:00:00+00', '2026-05-17 12:00:00+00', 'America/Los_Angeles', NULL, NULL, '0', 'aa545fd3-e827-40d0-a017-1d35b5f42aa9', 'aa545fd3-e827-40d0-a017-1d35b5f42aa9', '2026-02-09 08:09:54.492496+00', '2026-02-09 08:09:54.492496+00');
INSERT INTO gigs (id, title, status, tags, start, "end", timezone, notes, parent_gig_id, hierarchy_depth, created_by, updated_by, created_at, updated_at) VALUES ('a518ec75-8fd7-4cea-b2cc-79581c908a92', 'Milbourne Sound @ Campolindo 5/29/2026', 'Booked', '{Stage}', '2026-05-29 12:00:00+00', '2026-05-29 12:00:00+00', 'America/Los_Angeles', 'High School Graduation', NULL, '0', 'aa545fd3-e827-40d0-a017-1d35b5f42aa9', 'aa545fd3-e827-40d0-a017-1d35b5f42aa9', '2026-02-09 08:09:54.762068+00', '2026-02-09 08:09:54.762068+00');
INSERT INTO gigs (id, title, status, tags, start, "end", timezone, notes, parent_gig_id, hierarchy_depth, created_by, updated_by, created_at, updated_at) VALUES ('2888be19-92ea-4fb9-9a42-d85ec71265bb', 'Midnight Reruns @ Hazy 6/12/2026', 'Booked', '{Small}', '2026-06-12 12:00:00+00', '2026-06-12 12:00:00+00', 'America/Los_Angeles', 'Acoustic Gig', NULL, '0', 'aa545fd3-e827-40d0-a017-1d35b5f42aa9', 'aa545fd3-e827-40d0-a017-1d35b5f42aa9', '2026-02-09 08:09:56.241266+00', '2026-02-09 08:09:56.241266+00');
INSERT INTO gigs (id, title, status, tags, start, "end", timezone, notes, parent_gig_id, hierarchy_depth, created_by, updated_by, created_at, updated_at) VALUES ('9681acd9-588a-4d37-9a73-70e5e8c5a1ed', 'Spazmatics @ Dan''s 8/14/2026', 'Booked', '{PA,Lights}', '2026-08-14 12:00:00+00', '2026-08-14 12:00:00+00', 'America/Los_Angeles', NULL, NULL, '0', 'aa545fd3-e827-40d0-a017-1d35b5f42aa9', 'aa545fd3-e827-40d0-a017-1d35b5f42aa9', '2026-02-09 08:09:58.014145+00', '2026-02-09 08:09:58.014145+00');
INSERT INTO gigs (id, title, status, tags, start, "end", timezone, notes, parent_gig_id, hierarchy_depth, created_by, updated_by, created_at, updated_at) VALUES ('f94a88ef-cb13-409e-9138-005f56406e2a', 'Blue Valley @ Las Positas 10/9/2026', 'Booked', '{Lights,Mixing}', '2026-10-09 12:00:00+00', '2026-10-09 12:00:00+00', 'America/Los_Angeles', NULL, NULL, '0', 'aa545fd3-e827-40d0-a017-1d35b5f42aa9', 'aa545fd3-e827-40d0-a017-1d35b5f42aa9', '2026-02-09 08:10:00.194201+00', '2026-02-09 08:10:00.194201+00');
INSERT INTO gigs (id, title, status, tags, start, "end", timezone, notes, parent_gig_id, hierarchy_depth, created_by, updated_by, created_at, updated_at) VALUES ('06b0b468-2da2-4b00-8adb-9ea3ad577ba6', 'Revive @ Creekside 11/15/2026', 'Booked', '{Mixing}', '2026-11-15 12:00:00+00', '2026-11-15 12:00:00+00', 'America/Los_Angeles', 'Thanksgiving Edition', NULL, '0', 'aa545fd3-e827-40d0-a017-1d35b5f42aa9', 'aa545fd3-e827-40d0-a017-1d35b5f42aa9', '2026-02-09 08:10:00.438874+00', '2026-02-09 08:10:00.438874+00');
INSERT INTO gigs (id, title, status, tags, start, "end", timezone, notes, parent_gig_id, hierarchy_depth, created_by, updated_by, created_at, updated_at) VALUES ('47e95e09-7a62-4560-92c5-42448b948f8f', 'Midnight Reruns @ Norm''s 11/20/2026', 'Booked', '{Mixing}', '2026-11-20 12:00:00+00', '2026-11-20 12:00:00+00', 'America/Los_Angeles', 'No gear.', NULL, '0', 'aa545fd3-e827-40d0-a017-1d35b5f42aa9', 'aa545fd3-e827-40d0-a017-1d35b5f42aa9', '2026-02-09 08:10:00.680271+00', '2026-02-09 08:10:00.680271+00');
INSERT INTO gigs (id, title, status, tags, start, "end", timezone, notes, parent_gig_id, hierarchy_depth, created_by, updated_by, created_at, updated_at) VALUES ('cf74f735-ecd2-41cb-8d4e-3a3cf46e18e1', 'Midnight Reruns @ Meenar''s 12/31/2026', 'Booked', '{Lights,PA}', '2026-12-31 12:00:00+00', '2026-12-31 12:00:00+00', 'America/Los_Angeles', 'New Year’s Eve Party', NULL, '0', 'aa545fd3-e827-40d0-a017-1d35b5f42aa9', 'aa545fd3-e827-40d0-a017-1d35b5f42aa9', '2026-02-09 08:10:00.925461+00', '2026-02-09 08:10:00.925461+00');
INSERT INTO gigs (id, title, status, tags, start, "end", timezone, notes, parent_gig_id, hierarchy_depth, created_by, updated_by, created_at, updated_at) VALUES ('571b8639-2e14-43d2-abc1-4dc85698d349', 'Various Acts @ Private 2/7/2026', 'Settled', '{Small,PA}', '2026-02-07 12:00:00+00', '2026-02-07 12:00:00+00', 'America/Los_Angeles', '90th Birthday Party', NULL, '0', 'aa545fd3-e827-40d0-a017-1d35b5f42aa9', 'aa545fd3-e827-40d0-a017-1d35b5f42aa9', '2026-02-09 08:09:51.664331+00', '2026-02-09 08:30:56.386843+00');
INSERT INTO gigs (id, title, status, tags, start, "end", timezone, notes, parent_gig_id, hierarchy_depth, created_by, updated_by, created_at, updated_at) VALUES ('24eabe32-f073-4370-bd5c-fe01e3929679', 'Neon Velvet @ SF Cruise Boat 9/3/2025', 'Completed', '{Stage}', '2025-09-03 12:00:00+00', '2025-09-03 12:00:00+00', 'America/Los_Angeles', '4:40 pm Load in, 7:00 pm boat sails, 9:30 pm boat returns, Hornblower Yacht Cruise, Pier 3 - Embarcadero, San Francisco, CA', NULL, '0', 'aa545fd3-e827-40d0-a017-1d35b5f42aa9', 'aa545fd3-e827-40d0-a017-1d35b5f42aa9', '2026-02-09 08:09:45.325623+00', '2026-02-09 08:09:45.325623+00');
INSERT INTO gigs (id, title, status, tags, start, "end", timezone, notes, parent_gig_id, hierarchy_depth, created_by, updated_by, created_at, updated_at) VALUES ('7ab563a1-44d8-4da5-952f-4f12e48d4308', 'Blue Valley @ Del Valle 9/19/2025', 'Completed', '{Mixing}', '2025-09-19 12:00:00+00', '2025-09-19 12:00:00+00', 'America/Los_Angeles', 'Livermore, CA. Load-in 3:30pm, show 6-9.', NULL, '0', 'aa545fd3-e827-40d0-a017-1d35b5f42aa9', 'aa545fd3-e827-40d0-a017-1d35b5f42aa9', '2026-02-09 08:09:46.720358+00', '2026-02-09 08:09:46.720358+00');
INSERT INTO gigs (id, title, status, tags, start, "end", timezone, notes, parent_gig_id, hierarchy_depth, created_by, updated_by, created_at, updated_at) VALUES ('2fe8894b-fa68-4ef3-9d8a-7162f8c2c42b', 'Neon Velvet @ SR Marriott 10/3/2025', 'Completed', '{Stage}', '2025-10-03 12:00:00+00', '2025-10-03 12:00:00+00', 'America/Los_Angeles', NULL, NULL, '0', 'aa545fd3-e827-40d0-a017-1d35b5f42aa9', 'aa545fd3-e827-40d0-a017-1d35b5f42aa9', '2026-02-09 08:09:47.993318+00', '2026-02-09 08:09:47.993318+00');
INSERT INTO gigs (id, title, status, tags, start, "end", timezone, notes, parent_gig_id, hierarchy_depth, created_by, updated_by, created_at, updated_at) VALUES ('6b1decfb-65f5-413c-a359-23811f1f6d7c', 'Midnight Reruns @ Norm''s 10/24/2025', 'Cancelled', '{Lights,Mixing,Cancelled}', '2025-10-24 12:00:00+00', '2025-10-24 12:00:00+00', 'America/Los_Angeles', 'Use their PA. Bring lights, iPad.', NULL, '0', 'aa545fd3-e827-40d0-a017-1d35b5f42aa9', 'aa545fd3-e827-40d0-a017-1d35b5f42aa9', '2026-02-09 08:09:49.372725+00', '2026-02-09 08:09:49.372725+00');
INSERT INTO gigs (id, title, status, tags, start, "end", timezone, notes, parent_gig_id, hierarchy_depth, created_by, updated_by, created_at, updated_at) VALUES ('b36f454c-8117-46b2-b9ef-832ffe100d83', 'Midnight Reruns @ Mike Hess 10/25/2025', 'Cancelled', '{Lights,PA,Mixing,Cancelled}', '2025-10-25 12:00:00+00', '2025-10-25 12:00:00+00', 'America/Los_Angeles', 'Outdoors. band: 5-8pm. Sunset 6:15pm.', NULL, '0', 'aa545fd3-e827-40d0-a017-1d35b5f42aa9', 'aa545fd3-e827-40d0-a017-1d35b5f42aa9', '2026-02-09 08:09:49.64968+00', '2026-02-09 08:09:49.64968+00');
INSERT INTO gigs (id, title, status, tags, start, "end", timezone, notes, parent_gig_id, hierarchy_depth, created_by, updated_by, created_at, updated_at) VALUES ('9def06dc-306c-486e-a3f8-23fefe478818', 'Midnight Reruns @ Round Hill CC 11/1/2025', 'Completed', '{Mixing}', '2025-11-01 12:00:00+00', '2025-11-01 12:00:00+00', 'America/Los_Angeles', 'Fall Wine Tasting, 5-8. Acoustic Only.', NULL, '0', 'aa545fd3-e827-40d0-a017-1d35b5f42aa9', 'aa545fd3-e827-40d0-a017-1d35b5f42aa9', '2026-02-09 08:09:49.916816+00', '2026-02-09 08:09:49.916816+00');
INSERT INTO gigs (id, title, status, tags, start, "end", timezone, notes, parent_gig_id, hierarchy_depth, created_by, updated_by, created_at, updated_at) VALUES ('c832a4bb-3363-4f1b-8443-37998e62aa3c', 'Blue Valley @ Meenar''s 11/14/2025', 'Cancelled', '{Mixing,Cancelled}', '2025-11-14 12:00:00+00', '2025-11-14 12:00:00+00', 'America/Los_Angeles', 'Just not doing it.', NULL, '0', 'aa545fd3-e827-40d0-a017-1d35b5f42aa9', 'aa545fd3-e827-40d0-a017-1d35b5f42aa9', '2026-02-09 08:09:50.174553+00', '2026-02-09 08:09:50.174553+00');
INSERT INTO gigs (id, title, status, tags, start, "end", timezone, notes, parent_gig_id, hierarchy_depth, created_by, updated_by, created_at, updated_at) VALUES ('3cf8d225-1138-4997-84b8-541c52dbd3db', 'Midnight Reruns @ Round Hill CC 12/19/2025', 'Completed', '{Lights,PA,Tentative}', '2025-12-19 12:00:00+00', '2025-12-19 12:00:00+00', 'America/Los_Angeles', '($260 + 102.95 tax reimb) Private Holiday Party, should be $400', NULL, '0', 'aa545fd3-e827-40d0-a017-1d35b5f42aa9', 'aa545fd3-e827-40d0-a017-1d35b5f42aa9', '2026-02-09 08:09:50.436739+00', '2026-02-09 08:09:50.436739+00');
INSERT INTO gigs (id, title, status, tags, start, "end", timezone, notes, parent_gig_id, hierarchy_depth, created_by, updated_by, created_at, updated_at) VALUES ('c582b2a9-830e-418d-8b2e-2437062fcf41', 'Revive @ Creekside 3/26/2026', 'Booked', '{Mixing}', '2026-03-26 12:00:00+00', '2026-03-26 12:00:00+00', 'America/Los_Angeles', NULL, NULL, '0', 'aa545fd3-e827-40d0-a017-1d35b5f42aa9', 'aa545fd3-e827-40d0-a017-1d35b5f42aa9', '2026-02-09 08:09:52.996263+00', '2026-02-09 08:09:52.996263+00');
INSERT INTO gigs (id, title, status, tags, start, "end", timezone, notes, parent_gig_id, hierarchy_depth, created_by, updated_by, created_at, updated_at) VALUES ('0717da11-9d9e-4e8d-ba5e-d7769be4614a', 'Midnight Reruns @ Meenar''s 3/28/2026', 'Booked', '{Lights,PA}', '2026-03-28 12:00:00+00', '2026-03-28 12:00:00+00', 'America/Los_Angeles', NULL, NULL, '0', 'aa545fd3-e827-40d0-a017-1d35b5f42aa9', 'aa545fd3-e827-40d0-a017-1d35b5f42aa9', '2026-02-09 08:09:53.26248+00', '2026-02-09 08:09:53.26248+00');
INSERT INTO gigs (id, title, status, tags, start, "end", timezone, notes, parent_gig_id, hierarchy_depth, created_by, updated_by, created_at, updated_at) VALUES ('754a3af1-26c1-4645-9740-2bc7dc9e59de', 'Powerplay @  4/25/2026', 'Booked', '{Lights,Stage}', '2026-04-25 12:00:00+00', '2026-04-25 12:00:00+00', 'America/Los_Angeles', 'Milbourne Sound', NULL, '0', 'aa545fd3-e827-40d0-a017-1d35b5f42aa9', 'aa545fd3-e827-40d0-a017-1d35b5f42aa9', '2026-02-09 08:09:53.604464+00', '2026-02-09 08:09:53.604464+00');
INSERT INTO gigs (id, title, status, tags, start, "end", timezone, notes, parent_gig_id, hierarchy_depth, created_by, updated_by, created_at, updated_at) VALUES ('feaaa92c-d3ac-4cf6-9ae6-871ad5807566', 'Midnight Reruns @ Norm''s 5/29/2026', 'Proposed', '{Lights,Mixing,Conflict}', '2026-05-29 12:00:00+00', '2026-05-29 12:00:00+00', 'America/Los_Angeles', 'No gear.', NULL, '0', 'aa545fd3-e827-40d0-a017-1d35b5f42aa9', 'aa545fd3-e827-40d0-a017-1d35b5f42aa9', '2026-02-09 08:09:55.069693+00', '2026-02-09 08:09:55.069693+00');
INSERT INTO gigs (id, title, status, tags, start, "end", timezone, notes, parent_gig_id, hierarchy_depth, created_by, updated_by, created_at, updated_at) VALUES ('b8af02cc-6e76-4097-9b91-e8d3b2006582', 'Spazmatics @ Dan''s 6/5/2026', 'Booked', '{PA,Lights}', '2026-06-05 12:00:00+00', '2026-06-05 12:00:00+00', 'America/Los_Angeles', 'Possible conflict with WC Art and Wine setup in the afternoon.', NULL, '0', 'aa545fd3-e827-40d0-a017-1d35b5f42aa9', 'aa545fd3-e827-40d0-a017-1d35b5f42aa9', '2026-02-09 08:09:55.306433+00', '2026-02-09 08:09:55.306433+00');
INSERT INTO gigs (id, title, status, tags, start, "end", timezone, notes, parent_gig_id, hierarchy_depth, created_by, updated_by, created_at, updated_at) VALUES ('86b031cd-94e3-40a7-987d-d5d974429837', 'Summer Concerts @ Fremont 6/26/2026', 'Booked', '{Stage,Mixing}', '2026-06-26 12:00:00+00', '2026-06-26 12:00:00+00', 'America/Los_Angeles', 'Milbourne Sound, Maybe me mixing', NULL, '0', 'aa545fd3-e827-40d0-a017-1d35b5f42aa9', 'aa545fd3-e827-40d0-a017-1d35b5f42aa9', '2026-02-09 08:09:56.580076+00', '2026-02-09 08:09:56.580076+00');
INSERT INTO gigs (id, title, status, tags, start, "end", timezone, notes, parent_gig_id, hierarchy_depth, created_by, updated_by, created_at, updated_at) VALUES ('2acd506e-9062-4dea-9ccd-8d43f2207f9c', 'Midnight Reruns @ Norm''s 8/21/2026', 'Booked', '{Mixing}', '2026-08-21 12:00:00+00', '2026-08-21 12:00:00+00', 'America/Los_Angeles', 'No gear.', NULL, '0', 'aa545fd3-e827-40d0-a017-1d35b5f42aa9', 'aa545fd3-e827-40d0-a017-1d35b5f42aa9', '2026-02-09 08:09:58.320492+00', '2026-02-09 08:09:58.320492+00');
INSERT INTO gigs (id, title, status, tags, start, "end", timezone, notes, parent_gig_id, hierarchy_depth, created_by, updated_by, created_at, updated_at) VALUES ('606e743c-d7df-488c-9ebe-e36a12bfc127', 'Summer Concerts @ Fremont 8/28/2026', 'Booked', '{Stage}', '2026-08-28 12:00:00+00', '2026-08-28 12:00:00+00', 'America/Los_Angeles', 'Milbourne Sound', NULL, '0', 'aa545fd3-e827-40d0-a017-1d35b5f42aa9', 'aa545fd3-e827-40d0-a017-1d35b5f42aa9', '2026-02-09 08:09:58.558835+00', '2026-02-09 08:09:58.558835+00');
INSERT INTO gigs (id, title, status, tags, start, "end", timezone, notes, parent_gig_id, hierarchy_depth, created_by, updated_by, created_at, updated_at) VALUES ('66e04305-cff4-4a0a-a5ae-769d479bdab9', 'Private @ Bridges CC 9/5/2025', 'Completed', '{Mixing}', '2025-09-05 12:00:00+00', '2025-09-05 12:00:00+00', 'America/Los_Angeles', 'Bridges GC. Loadin 3:00pm. Doors 6:00pm. Loadout 6pm.  (2 Trips)', NULL, '0', 'aa545fd3-e827-40d0-a017-1d35b5f42aa9', 'aa545fd3-e827-40d0-a017-1d35b5f42aa9', '2026-02-09 08:09:45.700057+00', '2026-02-09 08:09:45.700057+00');
INSERT INTO gigs (id, title, status, tags, start, "end", timezone, notes, parent_gig_id, hierarchy_depth, created_by, updated_by, created_at, updated_at) VALUES ('d51c8555-bc40-4649-b84a-bea439e03414', 'Foreverland @ Fremont 9/26/2025', 'Completed', '{Stage}', '2025-09-26 12:00:00+00', '2025-09-26 12:00:00+00', 'America/Los_Angeles', NULL, NULL, '0', 'aa545fd3-e827-40d0-a017-1d35b5f42aa9', 'aa545fd3-e827-40d0-a017-1d35b5f42aa9', '2026-02-09 08:09:47.05629+00', '2026-02-09 08:09:47.05629+00');
INSERT INTO gigs (id, title, status, tags, start, "end", timezone, notes, parent_gig_id, hierarchy_depth, created_by, updated_by, created_at, updated_at) VALUES ('0971a6e3-a628-4529-9cbc-8a372569f90b', 'Blue Valley @ Las Positas 10/11/2025', 'Completed', '{PA}', '2025-10-11 12:00:00+00', '2025-10-11 12:00:00+00', 'America/Los_Angeles', NULL, NULL, '0', 'aa545fd3-e827-40d0-a017-1d35b5f42aa9', 'aa545fd3-e827-40d0-a017-1d35b5f42aa9', '2026-02-09 08:09:48.305138+00', '2026-02-09 08:09:48.305138+00');
INSERT INTO gigs (id, title, status, tags, start, "end", timezone, notes, parent_gig_id, hierarchy_depth, created_by, updated_by, created_at, updated_at) VALUES ('dbbd018e-9007-45be-8306-7272ece132bd', 'Midnight Reruns @ Round Hill CC 12/20/2025', 'Cancelled', '{Tentative,Mixing,Cancelled}', '2025-12-20 12:00:00+00', '2025-12-20 12:00:00+00', 'America/Los_Angeles', 'Private Holiday Party — Acoustic Only', NULL, '0', 'aa545fd3-e827-40d0-a017-1d35b5f42aa9', 'aa545fd3-e827-40d0-a017-1d35b5f42aa9', '2026-02-09 08:09:50.719417+00', '2026-02-09 08:09:50.719417+00');
INSERT INTO gigs (id, title, status, tags, start, "end", timezone, notes, parent_gig_id, hierarchy_depth, created_by, updated_by, created_at, updated_at) VALUES ('ea13d9e3-5e97-44f6-b2d0-0dd3db79ad32', 'Spazmatics @ Dan''s 1/23/2026', 'Completed', '{PA,Lights}', '2026-01-23 12:00:00+00', '2026-01-23 12:00:00+00', 'America/Los_Angeles', 'Cash, Uhaul $60, Gas $12', NULL, '0', 'aa545fd3-e827-40d0-a017-1d35b5f42aa9', 'aa545fd3-e827-40d0-a017-1d35b5f42aa9', '2026-02-09 08:09:50.971822+00', '2026-02-09 08:09:50.971822+00');
INSERT INTO gigs (id, title, status, tags, start, "end", timezone, notes, parent_gig_id, hierarchy_depth, created_by, updated_by, created_at, updated_at) VALUES ('425d1e79-8ed9-4367-8dff-afa1602b207f', 'Spazmatics @ Dan''s 5/15/2026', 'Booked', '{PA,Lights}', '2026-05-15 12:00:00+00', '2026-05-15 12:00:00+00', 'America/Los_Angeles', NULL, NULL, '0', 'aa545fd3-e827-40d0-a017-1d35b5f42aa9', 'aa545fd3-e827-40d0-a017-1d35b5f42aa9', '2026-02-09 08:09:53.895104+00', '2026-02-09 08:09:53.895104+00');
INSERT INTO gigs (id, title, status, tags, start, "end", timezone, notes, parent_gig_id, hierarchy_depth, created_by, updated_by, created_at, updated_at) VALUES ('b2a54a50-45bf-434e-99cb-6cfaba2af0fe', 'Milbourne Sound @ WC Art-n-Wine 6/6/2026', 'Booked', '{Mixing,Stage}', '2026-06-06 12:00:00+00', '2026-06-06 12:00:00+00', 'America/Los_Angeles', 'Start at Noon — 10 or 11am call time.', NULL, '0', 'aa545fd3-e827-40d0-a017-1d35b5f42aa9', 'aa545fd3-e827-40d0-a017-1d35b5f42aa9', '2026-02-09 08:09:55.611103+00', '2026-02-09 08:09:55.611103+00');
INSERT INTO gigs (id, title, status, tags, start, "end", timezone, notes, parent_gig_id, hierarchy_depth, created_by, updated_by, created_at, updated_at) VALUES ('54358ce8-0f7c-4f63-8a5b-44922cc65fec', 'Powerplay @ Private 7/10/2026', 'Booked', '{Stage,Lights}', '2026-07-10 12:00:00+00', '2026-07-10 12:00:00+00', 'America/Los_Angeles', 'Wedding with Mark Milbourne', NULL, '0', 'aa545fd3-e827-40d0-a017-1d35b5f42aa9', 'aa545fd3-e827-40d0-a017-1d35b5f42aa9', '2026-02-09 08:09:56.89091+00', '2026-02-09 08:09:56.89091+00');
INSERT INTO gigs (id, title, status, tags, start, "end", timezone, notes, parent_gig_id, hierarchy_depth, created_by, updated_by, created_at, updated_at) VALUES ('1a85d900-e4d4-41aa-bdcc-17e1412b4bad', 'Midnight Reruns @ Meenar''s 7/11/2026', 'Booked', '{Lights,PA}', '2026-07-11 12:00:00+00', '2026-07-11 12:00:00+00', 'America/Los_Angeles', NULL, NULL, '0', 'aa545fd3-e827-40d0-a017-1d35b5f42aa9', 'aa545fd3-e827-40d0-a017-1d35b5f42aa9', '2026-02-09 08:09:57.152424+00', '2026-02-09 08:09:57.152424+00');
INSERT INTO gigs (id, title, status, tags, start, "end", timezone, notes, parent_gig_id, hierarchy_depth, created_by, updated_by, created_at, updated_at) VALUES ('66e99d56-061f-4dc5-a6f3-a7d0f4bd493c', 'Revive @ Creekside 9/13/2026', 'Booked', '{Mixing}', '2026-09-13 12:00:00+00', '2026-09-13 12:00:00+00', 'America/Los_Angeles', NULL, NULL, '0', 'aa545fd3-e827-40d0-a017-1d35b5f42aa9', 'aa545fd3-e827-40d0-a017-1d35b5f42aa9', '2026-02-09 08:09:58.830919+00', '2026-02-09 08:09:58.830919+00');
INSERT INTO gigs (id, title, status, tags, start, "end", timezone, notes, parent_gig_id, hierarchy_depth, created_by, updated_by, created_at, updated_at) VALUES ('90cd1e8a-c72b-4f76-afce-4da1e4fd8c08', 'Midnight Reruns @ Hazy 9/18/2026', 'Booked', '{Small}', '2026-09-18 12:00:00+00', '2026-09-18 12:00:00+00', 'America/Los_Angeles', 'Acoustic Gig', NULL, '0', 'aa545fd3-e827-40d0-a017-1d35b5f42aa9', 'aa545fd3-e827-40d0-a017-1d35b5f42aa9', '2026-02-09 08:09:59.090871+00', '2026-02-09 08:09:59.090871+00');
INSERT INTO gigs (id, title, status, tags, start, "end", timezone, notes, parent_gig_id, hierarchy_depth, created_by, updated_by, created_at, updated_at) VALUES ('6ee36296-acbd-4c60-9d83-825339a121cc', 'Last One Picked @ Orinda Park 9/11/2025', 'Completed', '{PA}', '2025-09-11 12:00:00+00', '2025-09-11 12:00:00+00', 'America/Los_Angeles', 'Mel Speed Gig', NULL, '0', 'aa545fd3-e827-40d0-a017-1d35b5f42aa9', 'aa545fd3-e827-40d0-a017-1d35b5f42aa9', '2026-02-09 08:09:46.045872+00', '2026-02-09 08:09:46.045872+00');
INSERT INTO gigs (id, title, status, tags, start, "end", timezone, notes, parent_gig_id, hierarchy_depth, created_by, updated_by, created_at, updated_at) VALUES ('fb362402-77fe-4b70-868c-cec7e1300354', 'Midnight Reruns @ Meenar''s 9/27/2025', 'Completed', '{Lights,PA}', '2025-09-27 12:00:00+00', '2025-09-27 12:00:00+00', 'America/Los_Angeles', 'More full setup. 6:30.  Cash payment.', NULL, '0', 'aa545fd3-e827-40d0-a017-1d35b5f42aa9', 'aa545fd3-e827-40d0-a017-1d35b5f42aa9', '2026-02-09 08:09:47.343372+00', '2026-02-09 08:09:47.343372+00');
INSERT INTO gigs (id, title, status, tags, start, "end", timezone, notes, parent_gig_id, hierarchy_depth, created_by, updated_by, created_at, updated_at) VALUES ('a061fefe-f7c6-4d1f-9976-49261da21b2f', 'Bray and the Dens @ Club Fox 10/17/2025', 'Completed', '{Stage}', '2025-10-17 12:00:00+00', '2025-10-17 12:00:00+00', 'America/Los_Angeles', 'Recording', NULL, '0', 'aa545fd3-e827-40d0-a017-1d35b5f42aa9', 'aa545fd3-e827-40d0-a017-1d35b5f42aa9', '2026-02-09 08:09:48.680624+00', '2026-02-09 08:09:48.680624+00');
INSERT INTO gigs (id, title, status, tags, start, "end", timezone, notes, parent_gig_id, hierarchy_depth, created_by, updated_by, created_at, updated_at) VALUES ('c4d2f505-4134-48ec-b9a6-7b4d71682728', 'Midnight Reruns @ Norm''s 2/27/2026', 'Proposed', '{Mixing,Conflict}', '2026-02-27 12:00:00+00', '2026-02-27 12:00:00+00', 'America/Los_Angeles', 'CONFLICT.', NULL, '0', 'aa545fd3-e827-40d0-a017-1d35b5f42aa9', 'aa545fd3-e827-40d0-a017-1d35b5f42aa9', '2026-02-09 08:09:52.151995+00', '2026-02-09 08:09:52.151995+00');
INSERT INTO gigs (id, title, status, tags, start, "end", timezone, notes, parent_gig_id, hierarchy_depth, created_by, updated_by, created_at, updated_at) VALUES ('82bd57e8-bc54-46d6-9f77-b73fb4b0f9b1', 'Spazmatics @ Dan''s 2/27/2026', 'Booked', '{PA,Lights}', '2026-02-27 12:00:00+00', '2026-02-27 12:00:00+00', 'America/Los_Angeles', NULL, NULL, '0', 'aa545fd3-e827-40d0-a017-1d35b5f42aa9', 'aa545fd3-e827-40d0-a017-1d35b5f42aa9', '2026-02-09 08:09:52.392813+00', '2026-02-09 08:09:52.392813+00');
INSERT INTO gigs (id, title, status, tags, start, "end", timezone, notes, parent_gig_id, hierarchy_depth, created_by, updated_by, created_at, updated_at) VALUES ('96ede74e-c30b-419f-8513-93466f02150a', 'Blue Valley @ Las Positas 5/16/2026', 'Proposed', '{Mixing}', '2026-05-16 12:00:00+00', '2026-05-16 12:00:00+00', 'America/Los_Angeles', NULL, NULL, '0', 'aa545fd3-e827-40d0-a017-1d35b5f42aa9', 'aa545fd3-e827-40d0-a017-1d35b5f42aa9', '2026-02-09 08:09:54.197477+00', '2026-02-09 08:09:54.197477+00');
INSERT INTO gigs (id, title, status, tags, start, "end", timezone, notes, parent_gig_id, hierarchy_depth, created_by, updated_by, created_at, updated_at) VALUES ('15215058-48ae-44f6-9f62-807c6ccdf0d7', 'Milbourne Sound @ WC Art-n-Wine 6/7/2026', 'Booked', '{Mixing,Stage}', '2026-06-07 12:00:00+00', '2026-06-07 12:00:00+00', 'America/Los_Angeles', NULL, NULL, '0', 'aa545fd3-e827-40d0-a017-1d35b5f42aa9', 'aa545fd3-e827-40d0-a017-1d35b5f42aa9', '2026-02-09 08:09:55.959024+00', '2026-02-09 08:09:55.959024+00');
INSERT INTO gigs (id, title, status, tags, start, "end", timezone, notes, parent_gig_id, hierarchy_depth, created_by, updated_by, created_at, updated_at) VALUES ('2df30e5f-b860-4870-8a91-16823353f010', 'Revive @ Creekside 7/12/2026', 'Booked', '{Mixing}', '2026-07-12 12:00:00+00', '2026-07-12 12:00:00+00', 'America/Los_Angeles', 'Outdoor Edition', NULL, '0', 'aa545fd3-e827-40d0-a017-1d35b5f42aa9', 'aa545fd3-e827-40d0-a017-1d35b5f42aa9', '2026-02-09 08:09:57.453882+00', '2026-02-09 08:09:57.453882+00');
INSERT INTO gigs (id, title, status, tags, start, "end", timezone, notes, parent_gig_id, hierarchy_depth, created_by, updated_by, created_at, updated_at) VALUES ('007dade4-7768-4a5e-88df-09148dc6d006', 'Summer Concerts @ Fremont 7/24/2026', 'Booked', '{Stage}', '2026-07-24 12:00:00+00', '2026-07-24 12:00:00+00', 'America/Los_Angeles', 'Milbourne Sound', NULL, '0', 'aa545fd3-e827-40d0-a017-1d35b5f42aa9', 'aa545fd3-e827-40d0-a017-1d35b5f42aa9', '2026-02-09 08:09:57.711095+00', '2026-02-09 08:09:57.711095+00');
INSERT INTO gigs (id, title, status, tags, start, "end", timezone, notes, parent_gig_id, hierarchy_depth, created_by, updated_by, created_at, updated_at) VALUES ('f17cfba2-9afb-42c7-8949-df6c272de3dd', 'Art & Wine Festival @  9/19/2026', 'Booked', '{Stage}', '2026-09-19 12:00:00+00', '2026-09-19 12:00:00+00', 'America/Los_Angeles', 'Milbourne Sound', NULL, '0', 'aa545fd3-e827-40d0-a017-1d35b5f42aa9', 'aa545fd3-e827-40d0-a017-1d35b5f42aa9', '2026-02-09 08:09:59.440247+00', '2026-02-09 08:09:59.440247+00');
INSERT INTO gigs (id, title, status, tags, start, "end", timezone, notes, parent_gig_id, hierarchy_depth, created_by, updated_by, created_at, updated_at) VALUES ('47745061-f574-46a7-8503-617ca0396d61', 'Art & Wine Festival @  9/20/2026', 'Booked', '{Stage}', '2026-09-20 12:00:00+00', '2026-09-20 12:00:00+00', 'America/Los_Angeles', 'Milbourne Sound', NULL, '0', 'aa545fd3-e827-40d0-a017-1d35b5f42aa9', 'aa545fd3-e827-40d0-a017-1d35b5f42aa9', '2026-02-09 08:09:59.674575+00', '2026-02-09 08:09:59.674575+00');
INSERT INTO gigs (id, title, status, tags, start, "end", timezone, notes, parent_gig_id, hierarchy_depth, created_by, updated_by, created_at, updated_at) VALUES ('1ce45cbd-7448-4cf6-a7e3-c59688e361f6', 'Summer Concerts @ Fremont 9/25/2026', 'Booked', '{Stage}', '2026-09-25 12:00:00+00', '2026-09-25 12:00:00+00', 'America/Los_Angeles', 'Milbourne Sound', NULL, '0', 'aa545fd3-e827-40d0-a017-1d35b5f42aa9', 'aa545fd3-e827-40d0-a017-1d35b5f42aa9', '2026-02-09 08:09:59.905439+00', '2026-02-09 08:09:59.905439+00');
INSERT INTO gigs (id, title, status, tags, start, "end", timezone, notes, parent_gig_id, hierarchy_depth, created_by, updated_by, created_at, updated_at) VALUES ('7c9c6305-e4ae-4833-8aba-357cb920b7d9', 'Unavailable', 'DateHold', '{Conflict}', '2026-02-16 12:00:00+00', '2026-02-21 12:00:00+00', 'America/Los_Angeles', 'Out of Town', NULL, '0', 'aa545fd3-e827-40d0-a017-1d35b5f42aa9', 'aa545fd3-e827-40d0-a017-1d35b5f42aa9', '2026-02-09 08:09:51.88863+00', '2026-02-09 08:12:30.273542+00');
INSERT INTO gigs (id, title, status, tags, start, "end", timezone, notes, parent_gig_id, hierarchy_depth, created_by, updated_by, created_at, updated_at) VALUES ('932f11fc-1e8c-4318-8a34-a8e59ece180c', 'Midnight Reruns @  1/31/2026', 'Settled', '{Small}', '2026-01-31 12:00:00+00', '2026-01-31 12:00:00+00', 'America/Los_Angeles', 'Acoustic gig in Danville at the Growler. Includes setup.', NULL, '0', 'aa545fd3-e827-40d0-a017-1d35b5f42aa9', 'aa545fd3-e827-40d0-a017-1d35b5f42aa9', '2026-02-09 08:09:51.335862+00', '2026-02-09 08:23:24.826835+00');


--
-- Data for Name: users; Type: TABLE DATA; Schema: public; Owner: postgres
--

INSERT INTO users (id, email, first_name, last_name, phone, avatar_url, address_line1, address_line2, city, state, postal_code, country, role_hint, user_status, created_at, updated_at, timezone) VALUES ('02c16e23-7859-491e-8788-84f4066f2f40', 'cameron.orourke+mark@gmail.com', 'Mark', 'Milbourne', NULL, NULL, NULL, NULL, NULL, NULL, NULL, NULL, NULL, 'active', '2026-02-03 03:31:19.730855+00', '2026-02-03 03:31:19.730855+00', NULL);
INSERT INTO users (id, email, first_name, last_name, phone, avatar_url, address_line1, address_line2, city, state, postal_code, country, role_hint, user_status, created_at, updated_at, timezone) VALUES ('6dd4ab14-a3b0-402e-be1a-b50ffcb89fb2', 'cameron.orourke+sam@gmail.com', 'Sam', 'Smith', NULL, NULL, NULL, NULL, NULL, NULL, NULL, NULL, NULL, 'active', '2026-02-03 03:53:39.931294+00', '2026-02-03 04:00:05.397165+00', NULL);
INSERT INTO users (id, email, first_name, last_name, phone, avatar_url, address_line1, address_line2, city, state, postal_code, country, role_hint, user_status, created_at, updated_at, timezone) VALUES ('b470fcce-cdea-4647-9ba7-19f501a26343', 'cameron.orourke+colin@gmail.com', 'Colin', 'Mac', '', '', '', '', '', '', '', '', NULL, 'pending', '2026-02-03 03:09:17.106623+00', '2026-02-04 04:38:03.696494+00', NULL);
INSERT INTO users (id, email, first_name, last_name, phone, avatar_url, address_line1, address_line2, city, state, postal_code, country, role_hint, user_status, created_at, updated_at, timezone) VALUES ('54eb084b-a81b-4c13-bdd8-a9f450351eac', 'cameron.orourke+joe@gmail.com', 'Joe', 'Johnson', '925-858-0411', NULL, NULL, NULL, NULL, NULL, NULL, NULL, NULL, 'active', '2026-02-04 07:16:29.767485+00', '2026-02-04 20:04:03.352894+00', NULL);
INSERT INTO users (id, email, first_name, last_name, phone, avatar_url, address_line1, address_line2, city, state, postal_code, country, role_hint, user_status, created_at, updated_at, timezone) VALUES ('016b9cc5-3f46-47b2-ad42-9e6a090fe278', 'cameron.orourke+matt@gmail.com', 'Matt', 'Walsh', '', '', '', '', '', '', '', '', NULL, 'active', '2026-02-03 20:41:54.795639+00', '2026-02-08 03:28:53.354631+00', NULL);
INSERT INTO users (id, email, first_name, last_name, phone, avatar_url, address_line1, address_line2, city, state, postal_code, country, role_hint, user_status, created_at, updated_at, timezone) VALUES ('aa545fd3-e827-40d0-a017-1d35b5f42aa9', 'cameron.orourke@gmail.com', 'Cameron', 'O''Rourke', '925-858-0411', '', '24 Lynnbrook Court', NULL, 'San Ramon', NULL, NULL, NULL, NULL, 'active', '2026-01-29 21:26:11.984872+00', '2026-02-08 15:08:23.505734+00', 'America/Los_Angeles');


--
-- Data for Name: gig_financials; Type: TABLE DATA; Schema: public; Owner: postgres
--

INSERT INTO gig_financials (id, gig_id, organization_id, amount, date, notes, created_by, created_at, type, category, reference_number, counterparty_id, external_entity_name, currency, description, due_date, paid_at, updated_by, updated_at) VALUES ('a4b12d03-ab01-4bda-a9ea-f6aaa84f76c7', '5796bd45-00e7-4d3d-985a-fad7c9d96165', '09fca024-b5c1-4f81-a71b-a68361548948', '208.00', '2025-02-22', NULL, 'aa545fd3-e827-40d0-a017-1d35b5f42aa9', '2026-02-09 08:09:35.85512+00', 'Payment Recieved', 'Production', NULL, NULL, NULL, 'USD', 'Payment from import', NULL, NULL, NULL, '2026-02-09 08:09:35.85512+00');
INSERT INTO gig_financials (id, gig_id, organization_id, amount, date, notes, created_by, created_at, type, category, reference_number, counterparty_id, external_entity_name, currency, description, due_date, paid_at, updated_by, updated_at) VALUES ('a44b258c-4905-4994-b61d-feec237f54a9', 'daca5a7d-b28e-484b-ab6d-851905fbf332', '09fca024-b5c1-4f81-a71b-a68361548948', '100.00', '2025-03-15', NULL, 'aa545fd3-e827-40d0-a017-1d35b5f42aa9', '2026-02-09 08:09:36.775894+00', 'Payment Recieved', 'Production', NULL, NULL, NULL, 'USD', 'Payment from import', NULL, NULL, NULL, '2026-02-09 08:09:36.775894+00');
INSERT INTO gig_financials (id, gig_id, organization_id, amount, date, notes, created_by, created_at, type, category, reference_number, counterparty_id, external_entity_name, currency, description, due_date, paid_at, updated_by, updated_at) VALUES ('810e6f46-055c-44cd-93fb-3b4dedf2836c', 'a6faf07b-6c52-41f9-89ad-d981a6dcc767', '09fca024-b5c1-4f81-a71b-a68361548948', '1040.00', '2025-03-27', NULL, 'aa545fd3-e827-40d0-a017-1d35b5f42aa9', '2026-02-09 08:09:37.134091+00', 'Payment Recieved', 'Production', NULL, NULL, NULL, 'USD', 'Payment from import', NULL, NULL, NULL, '2026-02-09 08:09:37.134091+00');
INSERT INTO gig_financials (id, gig_id, organization_id, amount, date, notes, created_by, created_at, type, category, reference_number, counterparty_id, external_entity_name, currency, description, due_date, paid_at, updated_by, updated_at) VALUES ('cddee572-cff7-4b5c-a9cf-cda82332e8e4', 'bb4b03d7-d200-4730-ab00-82dce5696de2', '09fca024-b5c1-4f81-a71b-a68361548948', '100.00', '2025-04-04', NULL, 'aa545fd3-e827-40d0-a017-1d35b5f42aa9', '2026-02-09 08:09:37.478452+00', 'Payment Recieved', 'Production', NULL, NULL, NULL, 'USD', 'Payment from import', NULL, NULL, NULL, '2026-02-09 08:09:37.478452+00');
INSERT INTO gig_financials (id, gig_id, organization_id, amount, date, notes, created_by, created_at, type, category, reference_number, counterparty_id, external_entity_name, currency, description, due_date, paid_at, updated_by, updated_at) VALUES ('dc08f1b9-3c23-4251-99a4-566fef82f23b', '0d93880b-4c73-4e00-bd43-e94f73b7beee', '09fca024-b5c1-4f81-a71b-a68361548948', '250.00', '2025-04-11', NULL, 'aa545fd3-e827-40d0-a017-1d35b5f42aa9', '2026-02-09 08:09:37.80283+00', 'Payment Recieved', 'Production', NULL, NULL, NULL, 'USD', 'Payment from import', NULL, NULL, NULL, '2026-02-09 08:09:37.80283+00');
INSERT INTO gig_financials (id, gig_id, organization_id, amount, date, notes, created_by, created_at, type, category, reference_number, counterparty_id, external_entity_name, currency, description, due_date, paid_at, updated_by, updated_at) VALUES ('0cd0e87f-5fa2-48ad-a423-4c684d620ce4', 'd126c89c-c02e-40c7-84a6-378e859bd1d4', '09fca024-b5c1-4f81-a71b-a68361548948', '250.00', '2025-05-03', NULL, 'aa545fd3-e827-40d0-a017-1d35b5f42aa9', '2026-02-09 08:09:38.360348+00', 'Payment Recieved', 'Production', NULL, NULL, NULL, 'USD', 'Payment from import', NULL, NULL, NULL, '2026-02-09 08:09:38.360348+00');
INSERT INTO gig_financials (id, gig_id, organization_id, amount, date, notes, created_by, created_at, type, category, reference_number, counterparty_id, external_entity_name, currency, description, due_date, paid_at, updated_by, updated_at) VALUES ('cba7cfad-2f56-43c8-80ec-344e29275d74', '429dba77-edf3-42d7-8011-3ecd74066463', '09fca024-b5c1-4f81-a71b-a68361548948', '250.00', '2025-05-09', NULL, 'aa545fd3-e827-40d0-a017-1d35b5f42aa9', '2026-02-09 08:09:38.709536+00', 'Payment Recieved', 'Production', NULL, NULL, NULL, 'USD', 'Payment from import', NULL, NULL, NULL, '2026-02-09 08:09:38.709536+00');
INSERT INTO gig_financials (id, gig_id, organization_id, amount, date, notes, created_by, created_at, type, category, reference_number, counterparty_id, external_entity_name, currency, description, due_date, paid_at, updated_by, updated_at) VALUES ('7376f67b-0f2f-4caf-80f0-535c7896f869', '736530f1-ac9c-45b1-814e-384102b3d24b', '09fca024-b5c1-4f81-a71b-a68361548948', '250.00', '2025-05-17', NULL, 'aa545fd3-e827-40d0-a017-1d35b5f42aa9', '2026-02-09 08:09:39.032358+00', 'Payment Recieved', 'Production', NULL, NULL, NULL, 'USD', 'Payment from import', NULL, NULL, NULL, '2026-02-09 08:09:39.032358+00');
INSERT INTO gig_financials (id, gig_id, organization_id, amount, date, notes, created_by, created_at, type, category, reference_number, counterparty_id, external_entity_name, currency, description, due_date, paid_at, updated_by, updated_at) VALUES ('18b54942-d6e6-4761-a810-fec6a473d4a3', '1aee5e52-1b9a-41b6-ad68-74988a827014', '09fca024-b5c1-4f81-a71b-a68361548948', '100.00', '2025-05-23', NULL, 'aa545fd3-e827-40d0-a017-1d35b5f42aa9', '2026-02-09 08:09:39.384114+00', 'Payment Recieved', 'Production', NULL, NULL, NULL, 'USD', 'Payment from import', NULL, NULL, NULL, '2026-02-09 08:09:39.384114+00');
INSERT INTO gig_financials (id, gig_id, organization_id, amount, date, notes, created_by, created_at, type, category, reference_number, counterparty_id, external_entity_name, currency, description, due_date, paid_at, updated_by, updated_at) VALUES ('9d3a626f-c758-4c8b-aa79-053eef9c0047', '223bb868-3ce8-4ee5-a39b-27016605ddb7', '09fca024-b5c1-4f81-a71b-a68361548948', '100.00', '2025-05-30', NULL, 'aa545fd3-e827-40d0-a017-1d35b5f42aa9', '2026-02-09 08:09:39.66832+00', 'Payment Recieved', 'Production', NULL, NULL, NULL, 'USD', 'Payment from import', NULL, NULL, NULL, '2026-02-09 08:09:39.66832+00');
INSERT INTO gig_financials (id, gig_id, organization_id, amount, date, notes, created_by, created_at, type, category, reference_number, counterparty_id, external_entity_name, currency, description, due_date, paid_at, updated_by, updated_at) VALUES ('efbb35bb-8914-4c52-9e80-1533b6523040', '655e8ad0-f20b-42c8-b9a3-af6cfed9bc97', '09fca024-b5c1-4f81-a71b-a68361548948', '400.00', '2025-05-31', NULL, 'aa545fd3-e827-40d0-a017-1d35b5f42aa9', '2026-02-09 08:09:40.021461+00', 'Payment Recieved', 'Production', NULL, NULL, NULL, 'USD', 'Payment from import', NULL, NULL, NULL, '2026-02-09 08:09:40.021461+00');
INSERT INTO gig_financials (id, gig_id, organization_id, amount, date, notes, created_by, created_at, type, category, reference_number, counterparty_id, external_entity_name, currency, description, due_date, paid_at, updated_by, updated_at) VALUES ('959f7fee-5d97-466f-a639-240876078baf', 'aeeb2919-1fb1-403b-b943-ce0e22a9175f', '09fca024-b5c1-4f81-a71b-a68361548948', '400.00', '2025-06-01', NULL, 'aa545fd3-e827-40d0-a017-1d35b5f42aa9', '2026-02-09 08:09:40.304894+00', 'Payment Recieved', 'Production', NULL, NULL, NULL, 'USD', 'Payment from import', NULL, NULL, NULL, '2026-02-09 08:09:40.304894+00');
INSERT INTO gig_financials (id, gig_id, organization_id, amount, date, notes, created_by, created_at, type, category, reference_number, counterparty_id, external_entity_name, currency, description, due_date, paid_at, updated_by, updated_at) VALUES ('692bcd95-f1b1-4b00-8aa0-16faa0444eaf', '73aaa3cc-fb44-40c6-89af-bed03146a96d', '09fca024-b5c1-4f81-a71b-a68361548948', '200.00', '2025-06-13', NULL, 'aa545fd3-e827-40d0-a017-1d35b5f42aa9', '2026-02-09 08:09:40.662716+00', 'Payment Recieved', 'Production', NULL, NULL, NULL, 'USD', 'Payment from import', NULL, NULL, NULL, '2026-02-09 08:09:40.662716+00');
INSERT INTO gig_financials (id, gig_id, organization_id, amount, date, notes, created_by, created_at, type, category, reference_number, counterparty_id, external_entity_name, currency, description, due_date, paid_at, updated_by, updated_at) VALUES ('82a0f4ce-a803-4653-a4e9-7fa01919225b', '27b08b7c-ca9f-4588-8674-02b85aa18795', '09fca024-b5c1-4f81-a71b-a68361548948', '80.00', '2025-06-14', NULL, 'aa545fd3-e827-40d0-a017-1d35b5f42aa9', '2026-02-09 08:09:40.943194+00', 'Payment Recieved', 'Production', NULL, NULL, NULL, 'USD', 'Payment from import', NULL, NULL, NULL, '2026-02-09 08:09:40.943194+00');
INSERT INTO gig_financials (id, gig_id, organization_id, amount, date, notes, created_by, created_at, type, category, reference_number, counterparty_id, external_entity_name, currency, description, due_date, paid_at, updated_by, updated_at) VALUES ('bc22df67-6a6c-4b86-aa8f-b841fbce32f2', '892ab327-b80d-4657-b47b-fffbf8750b74', '09fca024-b5c1-4f81-a71b-a68361548948', '700.00', '2025-06-26', NULL, 'aa545fd3-e827-40d0-a017-1d35b5f42aa9', '2026-02-09 08:09:41.31839+00', 'Payment Recieved', 'Production', NULL, NULL, NULL, 'USD', 'Payment from import', NULL, NULL, NULL, '2026-02-09 08:09:41.31839+00');
INSERT INTO gig_financials (id, gig_id, organization_id, amount, date, notes, created_by, created_at, type, category, reference_number, counterparty_id, external_entity_name, currency, description, due_date, paid_at, updated_by, updated_at) VALUES ('efcebbd6-2b85-4ab1-be6e-2fc93bb441ba', 'ecd68d89-0a1b-4e45-8208-91bda132a694', '09fca024-b5c1-4f81-a71b-a68361548948', '250.00', '2025-06-27', NULL, 'aa545fd3-e827-40d0-a017-1d35b5f42aa9', '2026-02-09 08:09:41.675739+00', 'Payment Recieved', 'Production', NULL, NULL, NULL, 'USD', 'Payment from import', NULL, NULL, NULL, '2026-02-09 08:09:41.675739+00');
INSERT INTO gig_financials (id, gig_id, organization_id, amount, date, notes, created_by, created_at, type, category, reference_number, counterparty_id, external_entity_name, currency, description, due_date, paid_at, updated_by, updated_at) VALUES ('97ad2bb9-1220-4092-a02c-7f828822c639', 'f9848f9e-9768-4707-8577-ba52c2ba52ba', '09fca024-b5c1-4f81-a71b-a68361548948', '100.00', '2025-07-03', NULL, 'aa545fd3-e827-40d0-a017-1d35b5f42aa9', '2026-02-09 08:09:41.998656+00', 'Payment Recieved', 'Production', NULL, NULL, NULL, 'USD', 'Payment from import', NULL, NULL, NULL, '2026-02-09 08:09:41.998656+00');
INSERT INTO gig_financials (id, gig_id, organization_id, amount, date, notes, created_by, created_at, type, category, reference_number, counterparty_id, external_entity_name, currency, description, due_date, paid_at, updated_by, updated_at) VALUES ('37719bbd-0ef8-4d10-8a4f-aa0f95ef16e3', '4eb3e09c-f88d-48b9-a0c6-c26532202a80', '09fca024-b5c1-4f81-a71b-a68361548948', '400.00', '2025-07-24', NULL, 'aa545fd3-e827-40d0-a017-1d35b5f42aa9', '2026-02-09 08:09:42.350708+00', 'Payment Recieved', 'Production', NULL, NULL, NULL, 'USD', 'Payment from import', NULL, NULL, NULL, '2026-02-09 08:09:42.350708+00');
INSERT INTO gig_financials (id, gig_id, organization_id, amount, date, notes, created_by, created_at, type, category, reference_number, counterparty_id, external_entity_name, currency, description, due_date, paid_at, updated_by, updated_at) VALUES ('3e97cead-d3df-45e7-bf39-11cd503da07b', 'd430cabd-f85d-437f-ace2-0d53b567d5d4', '09fca024-b5c1-4f81-a71b-a68361548948', '250.00', '2025-07-25', NULL, 'aa545fd3-e827-40d0-a017-1d35b5f42aa9', '2026-02-09 08:09:42.63206+00', 'Payment Recieved', 'Production', NULL, NULL, NULL, 'USD', 'Payment from import', NULL, NULL, NULL, '2026-02-09 08:09:42.63206+00');
INSERT INTO gig_financials (id, gig_id, organization_id, amount, date, notes, created_by, created_at, type, category, reference_number, counterparty_id, external_entity_name, currency, description, due_date, paid_at, updated_by, updated_at) VALUES ('ee797da7-5e98-4c27-b60b-061df9d1ec6c', '754a8c8f-6571-49a5-bfb9-4cab546b2b52', '09fca024-b5c1-4f81-a71b-a68361548948', '400.00', '2025-08-07', NULL, 'aa545fd3-e827-40d0-a017-1d35b5f42aa9', '2026-02-09 08:09:43.195372+00', 'Payment Recieved', 'Production', NULL, NULL, NULL, 'USD', 'Payment from import', NULL, NULL, NULL, '2026-02-09 08:09:43.195372+00');
INSERT INTO gig_financials (id, gig_id, organization_id, amount, date, notes, created_by, created_at, type, category, reference_number, counterparty_id, external_entity_name, currency, description, due_date, paid_at, updated_by, updated_at) VALUES ('54084c48-7444-43be-aca6-8ffdfaf93fa5', 'df03f2e6-f50b-46d6-8f6e-1725c6926509', '09fca024-b5c1-4f81-a71b-a68361548948', '150.00', '2025-08-08', NULL, 'aa545fd3-e827-40d0-a017-1d35b5f42aa9', '2026-02-09 08:09:43.497923+00', 'Payment Recieved', 'Production', NULL, NULL, NULL, 'USD', 'Payment from import', NULL, NULL, NULL, '2026-02-09 08:09:43.497923+00');
INSERT INTO gig_financials (id, gig_id, organization_id, amount, date, notes, created_by, created_at, type, category, reference_number, counterparty_id, external_entity_name, currency, description, due_date, paid_at, updated_by, updated_at) VALUES ('0fec6a42-3b54-4033-8d9c-9073a84fdeeb', '7168fe81-7290-4daf-8d16-19971965f907', '09fca024-b5c1-4f81-a71b-a68361548948', '526.00', '2025-08-09', NULL, 'aa545fd3-e827-40d0-a017-1d35b5f42aa9', '2026-02-09 08:09:43.817942+00', 'Payment Recieved', 'Production', NULL, NULL, NULL, 'USD', 'Payment from import', NULL, NULL, NULL, '2026-02-09 08:09:43.817942+00');
INSERT INTO gig_financials (id, gig_id, organization_id, amount, date, notes, created_by, created_at, type, category, reference_number, counterparty_id, external_entity_name, currency, description, due_date, paid_at, updated_by, updated_at) VALUES ('9f71ba26-287b-4e71-b891-7fbfbfa76b39', 'bc241120-b2af-4439-8373-65ea20929256', '09fca024-b5c1-4f81-a71b-a68361548948', '500.00', '2025-08-22', NULL, 'aa545fd3-e827-40d0-a017-1d35b5f42aa9', '2026-02-09 08:09:44.14258+00', 'Payment Recieved', 'Production', NULL, NULL, NULL, 'USD', 'Payment from import', NULL, NULL, NULL, '2026-02-09 08:09:44.14258+00');
INSERT INTO gig_financials (id, gig_id, organization_id, amount, date, notes, created_by, created_at, type, category, reference_number, counterparty_id, external_entity_name, currency, description, due_date, paid_at, updated_by, updated_at) VALUES ('985da5b6-e551-4ef5-b1ad-6603a3c9697b', '88c94db7-42b9-456d-b0b7-50cb7737cd80', '09fca024-b5c1-4f81-a71b-a68361548948', '400.00', '2025-08-28', NULL, 'aa545fd3-e827-40d0-a017-1d35b5f42aa9', '2026-02-09 08:09:45.039649+00', 'Payment Recieved', 'Production', NULL, NULL, NULL, 'USD', 'Payment from import', NULL, NULL, NULL, '2026-02-09 08:09:45.039649+00');
INSERT INTO gig_financials (id, gig_id, organization_id, amount, date, notes, created_by, created_at, type, category, reference_number, counterparty_id, external_entity_name, currency, description, due_date, paid_at, updated_by, updated_at) VALUES ('f06f5c8b-489d-40d6-941b-18a9c9ff5ccf', '24eabe32-f073-4370-bd5c-fe01e3929679', '09fca024-b5c1-4f81-a71b-a68361548948', '250.00', '2025-09-03', NULL, 'aa545fd3-e827-40d0-a017-1d35b5f42aa9', '2026-02-09 08:09:45.383351+00', 'Payment Recieved', 'Production', NULL, NULL, NULL, 'USD', 'Payment from import', NULL, NULL, NULL, '2026-02-09 08:09:45.383351+00');
